reviewId,userName,userImage,content,score,thumbsUpCount,reviewCreatedVersion,at,replyContent,repliedAt,appVersion
61f531cf-2fd2-4c12-9a40-a9d81790189c,Juni Saputra,https://play-lh.googleusercontent.com/a/ACg8ocIEEo4rcbm5GoM_kt0l4iwLyZoZfjU0bsruIgQzazsbHUSRfg=mo,"tolong sameday itu di hilangkan karena merugikan driver , jarak ambil kadang tidak masuk akal dan berikan fitur searah seperti gojek dalam 1 hari hanya 1x dipakai nya juga gak papa",5,10,7.40.1,04/14/2025 14:39,"Hai kak Nuril Huda
maaf yaa udh buat ga nyaman terkait kendala yg kakak alami. agar aku bisa bantu cek boleh infoin Username dan SS/detail kendala kakak melalui via Live Chat atau DM ke sosmed kita @Shopee_id/@Shopeecare ya. Have a nice day ^DM",04/14/2025 15:08,7.40.1
2a2366ad-3609-45a2-8633-9b4a7bd794b0,Ily 6666,https://play-lh.googleusercontent.com/a/ACg8ocLybChHVn7bj3X9LctJaGHOH9ag3N1e6MfBLH2EMNBXIITgeg=mo,"kak ini jam 10 malam,dan aku hafal daerah ku,letak,dan waktu toko tutup,lebih paham pihak kantor atau lapangan sih kak,mslh lapangan?kalau aku ambil dan cancel,sama saja kena suspend juga,kalau misal memang tidak boleh milah pesanan,di hapus aja kak,tombol menu(terima otomatis)nya,g guna dong,kak aku g kenal influence gede dan bnyk,tpi kenal bbrp,mungkin kalau mslh ini g kelar2,mungkin ku UP kak ke tiktok,ada beberapa influence yg memang model kontennya ngojol,jadi tolong di pahami, terimakasih",1,7,7.39.0,04/14/2025 14:35,"Hai kak Ily 6666
maaf yaa udh buat ga nyaman terkait kendala yg kakak alami. agar aku bisa bantu cek boleh infoin Username dan SS/detail kendala kakak melalui via Live Chat atau DM ke sosmed kita @Shopee_id/@Shopeecare ya. Have a nice day ^DM",04/14/2025 15:14,7.39.0
bc9a708e-acf1-4f55-b312-5d0995a0324e,Eko Ardiyanto,https://play-lh.googleusercontent.com/a-/ALV-UjWBDiA7W8uQN4h6Ze45z7g7zajr6CTuuYPG-gAOZJjGt8Sy0dc,"sebegitu banyak ulasan harusnya dijadikan bahan evaluasi agar lebih baik,,bukan malah makin ancur dan semaunya sendiri,,driver yg merasakan fakta dilapangan harusnya sudah cukup dan lebih buat bahan berbenah.",1,7,7.40.1,04/14/2025 14:26,"Hai kak Eko Ardiyanto
maaf yaa udh buat ga nyaman terkait kendala yg kakak alami. agar aku bisa bantu cek boleh infoin Username dan SS/detail kendala kakak melalui via Live Chat atau DM ke sosmed kita @Shopee_id/@Shopeecare ya. Have a nice day ^DM",04/14/2025 15:13,7.40.1
25c3824f-84e1-4008-8bb3-49c06f7a696a,Amrizal Fuadi,https://play-lh.googleusercontent.com/a/ACg8ocLbEjs_4ggj63sAx9vc1NYUFCaG81PTusRUXEcCEFZJLCIdFQ=mo,"tolong dong sistem di perbaiki masak orderan spx jam 2 pagi masuk, toko tutup driver ngancel kena point pelanggaran",3,0,7.38.0,04/14/2025 14:05,"Hai kak  Amrizal Fuadi
maaf yaa udh buat ga nyaman terkait kendala yg kakak alami. agar aku bisa bantu cek boleh infoin Username dan SS/detail kendala kakak melalui via Live Chat atau DM ke sosmed kita @Shopee_id/@Shopeecare ya. Have a nice day ^DM",04/14/2025 15:12,7.38.0
9b1b0a74-ddec-4380-9c5b-f50fb3a19f77,Mohammad Firmansyah,https://play-lh.googleusercontent.com/a/ACg8ocJKcuLzy06_ELJCi_YAy1tlJFCIi6CwXJwG9gTJfF6SsOXVzpY=mo,Aplikasi tolol. Iseng ambil orderan spx non marketplace jarak antar 6.7 km argonya 10.400. per km 1.600 mending jado kurir aja. 1.500 jarak antar paket 500m 3000 lah ini nunggu 1 km baru dapet 1.600.,1,2,,04/14/2025 13:56,"Hai kak Mohammad Firmansyah, mohon maaf ya atas ketidaknyamanannya terkait kendala yg kamu alami. Agar aku bisa bantu mohon infoin detail kendala ke DM Social Media IG kita @Shopee_id/@Shopeecare_id ya, stay safe ^LE",04/14/2025 15:21,
0405c734-74de-4e81-a94a-a5f9e30d2c5d,Arfi Susi,https://play-lh.googleusercontent.com/a/ACg8ocIPhae9ARgnaiX8UNqCiaKr0EDUCEp2usDQWvzqoJY_07sM7g=mo,"aplikasi terlalu sensitip dan tolong di buat kan untuk kasih rating ke resto , soal nya kalok lama ngantar pasti driver yang kena",1,1,7.38.0,04/14/2025 13:45,"Hai kak Arfi, maaf ya terkait dengan kendala yang Kakak alami, kami akan jadikan sebagai masukan untuk perbaikan agar menjadikan Shopeefood lebih baik lagi untuk para penggunanya. Jika kakak masih terkendala boleh infoin ke aku screnshoot kendalanya melalui DM IG @shopee_id ya. Sehat selalu ^LE",04/14/2025 15:07,7.38.0
b6edcdfc-95dd-429d-960f-0d7ee498ec0a,taopik hidayat,https://play-lh.googleusercontent.com/a-/ALV-UjUdI91rHI8pPVKh8abykKieunfRaCGjDSSw29-bGII-cdGKyWbPtg,sangat membantu,5,0,7.39.0,04/14/2025 13:36,"hi kak taopik hidayat, makasih buat review dan bintang nya, yuk cek aplikasi shopee biar ga ketinggalan promo-promo menarik lainnya biar tambah semangat belanjanya. kalo ada pertanyaan/kendala terkait Shopee boleh diinfoin ke DM IG @shopeecare_id yaa. terimakasih ^PO",04/14/2025 15:18,7.39.0
a4eea784-31d3-4a89-9a4d-9683dfa5f6a7,Mamad Zakaria2,https://play-lh.googleusercontent.com/a/ACg8ocIy__oK0luYtAUTfgdzAvagQ_HSACPzFKReFT4Xfrf8Faww2w=mo,maaf tolong naikin harga antar nya,4,0,7.39.0,04/14/2025 13:34,"Hi kak Mamad Zakaria2, maaf atas ketidaknyamanan nya. terkait feedback dari kakak akan dijadikan evaluasi agar pelayanan dan juga performa aplikasi Shopee semakin lebih baik lagi ke depan nya. Kalau ada kendala terkait Shopee kakak bisa DM IG @shopeecare_id ya kak. terimakasih ^PO",04/14/2025 15:10,7.39.0
7f58f850-d04e-4ff2-8001-7c639659552a,Huselman Gulo,https://play-lh.googleusercontent.com/a-/ALV-UjViA0aaotN5ucQZmDUvGW5MAE1g5WX0XLYU_lY0WdnIQOqT8kIo,mantap KLO bisa titik antar jemput nya di sesuaikan juga dgn ongkir nya jemput 10m antar 30m ongkir cmn 6.400k sekian dan terimakasih,5,0,7.39.0,04/14/2025 13:20,"Hai kak Huselman Gulo , makasih ya buat apresiasi kamu udh review dan kasih full star utk Shopee. yuk tingkatin terus pembelanjaan kamu dan jangan lupa pantengin terus updatean Shopee di sosmed resmi Shopee biar kamu ga ketinggalan update promo seru dari Shopee. Have a nice day ^PD",04/13/2025 11:05,7.39.0
ec341109-d4cc-4311-bfd8-5dec2274adac,Solihin Solihin,https://play-lh.googleusercontent.com/a/ACg8ocLBY8oJs9ohM1xAfk66xi-CDqDVxaWBtv2LP9AN6GTdgY3rJg=mo,"aplikasi bodoh , dapet samday posisi di jatiwaringin,ambil barang di bantargebang kirim barang ke ciputat, emang kaga ada driver lain apah, ambil barang ajah udah lebih dari 10km. cancel kena pinalti suspend 3hari padahal penyelesaian gw bagus, gk kurang dari 66%, dapet orderan 15, cancel 5 masa suspendbanding kaga pernah menang tolol nih aplikatornya",1,3,7.39.0,04/14/2025 13:15,,,7.39.0
639fd2b3-5975-47b4-863a-f6e8bfb4b67b,Jaso Tarduga L Gaol,https://play-lh.googleusercontent.com/a-/ALV-UjXkPpRGfrD47qq18RadLRsxBPv99rIPG30f9nYkvmevgetOLf0,"mohon di bantu saya tidak bisa menghubungkan akun shopeepay saya dengan shopee driver, muncul keterangan ups fitur belum tersedia",5,0,7.39.0,04/14/2025 12:43,"hi kak Jaso , maaf ya buat kendala terkait tidak bisa menghubungkan Shopeepay, biar bisa aku bantu, boleh infoin Username dan SS kendala kamu ke DM IG @shopeecare_id yaa. terimakasih ^PO",04/14/2025 14:19,7.39.0
5f7265d2-489e-441d-af26-7eea01d2ed49,Reza Alvarez,https://play-lh.googleusercontent.com/a-/ALV-UjXB2SiaiyXpFbTcBSsfjp893jEvXW2Agt86jiC_y_Tlccc62sk-,"aplikasi isinya poin , suspen , kek mana aplikasi ini , udh kek karyawan aja dibuat , harus diambil semua , ongkos lu gak ngotak sama sekali",1,1,7.39.0,04/14/2025 12:39,,,7.39.0
b7eee25c-06d2-4ba0-aa25-1c26b12d0150,Achmad Fauzi,https://play-lh.googleusercontent.com/a-/ALV-UjWOxmfbye7fMs7yxSMFglj7FacFlmbBcYOqGSZUKcHOATzgZ5I,double order ga jelas,1,0,7.39.0,04/14/2025 12:17,,,7.39.0
eb5fa766-4bad-49e5-bcbc-a00b359ae6ae,getar genta ramadhan,https://play-lh.googleusercontent.com/a/ACg8ocLeRzoZaZnB8C8Xa3MZNswzIsyvWeqUTZ63OALZG2XRvDx0Gw=mo,aplikatornya rakus,3,1,7.40.1,04/14/2025 11:07,,,7.40.1
edcb8cf7-af15-4677-8a2a-d0d7b6460157,Irman Rinjani,https://play-lh.googleusercontent.com/a-/ALV-UjUciiaZd6Si2wPwDTsYNzmZGI9DSYEB2TM348hywmTw8QhXuB7d,ngeri jarak pngambilannya......parah...sistemnya kagak pernah d maintenance....dongo it nya,1,3,7.40.1,04/14/2025 11:01,"hai kak. maaf ya udh bikin resah. Hal ini kami lakukan sebagai salah satu upaya untuk menciptakan lebih banyak peluang pekerjaan bagi Mitra Pengemudi, serta memperkuat komitmen kami untuk terus memberikan layanan terbaik bagi para Penjual dan Merchant di Shopee dan ShopeeFood dengan tersedianya armada pengantaran yang memadai. terima kasih:)^ZT",03/05/2022 10:23,7.40.1
f423e6c4-9f86-4a92-947e-a8d70035a004,FEBRI YANTO,https://play-lh.googleusercontent.com/a/ACg8ocJ5_np3SxMHhSEZTVvtgRT-ZZ4dky0Si4HkWiiX1FzrpAcO8x0=mo,aplikasi rusak,1,1,7.40.1,04/14/2025 10:40,,,7.40.1
1721d10c-79bc-4a6e-86bd-b4972407923c,Rony Wungkul,https://play-lh.googleusercontent.com/a-/ALV-UjUcuR_o1N7pg8czwnABd-lEXGkC7dh4Y9dzNdCWbgHNtD6s0tg,menyenangkan.,5,0,,04/14/2025 10:33,"hi kak Rony Wungkul, makasih buat review dan bintang nya, yuk cek aplikasi shopee biar ga ketinggalan promo-promo menarik lainnya biar tambah semangat belanjanya. kalo ada pertanyaan/kendala terkait Shopee boleh diinfoin ke DM IG @shopeecare_id yaa. terimakasih ^PO",04/14/2025 11:12,
8761638d-a135-440b-83cb-7e3e6658d634,Hanif Umar fikri,https://play-lh.googleusercontent.com/a/ACg8ocKrOFcfMxfqPFM-HyT9BQFHEP0nPaNZrHq1d4XNXGXVeBVRQQ=mo,bagus,5,0,7.39.0,04/14/2025 10:17,"hi kak Hanif Umar fikri, makasih buat review dan bintang nya, yuk cek aplikasi shopee biar ga ketinggalan promo-promo menarik lainnya biar tambah semangat belanjanya. kalo ada pertanyaan/kendala terkait Shopee boleh diinfoin ke DM IG @shopeecare_id yaa. terimakasih ^PO",04/14/2025 11:17,7.39.0
63b75d05-7d11-42d1-9a91-7f728494774b,Angga permandani,https://play-lh.googleusercontent.com/a-/ALV-UjVDCiIRdx91pE3N3QBBxEWo4oRgej7yAzG7V52-cvSJxgsnIUs,semoga semakin maju,5,0,7.39.0,04/14/2025 9:38,"Haii kak Angga permandani, makasih yaa buat review bintang 5 nya, yuk pantengin terus updatean dari sosmed resminya shopee dan aplikasi shopee yaa. Kalo ada kendala/pertanyaan lainnya bisa DM ke Social Media kita @shopee_id/@shopeecare_id. Sehat selalu ^ON",04/14/2025 10:08,7.39.0
b2045395-fbd7-4d25-92e3-7c0df6ef9f66,M. Farid Anam,https://play-lh.googleusercontent.com/a/ACg8ocKiEP4DWH99rUncQXJsqItAiOTD7Lq-i6HYYE124SiPew_9Wg=mo,sangat membantu yang pengangguran,5,0,,04/14/2025 9:37,"Haii kak M. Farid Anam, makasih yaa buat review bintang 5 nya, yuk pantengin terus updatean dari sosmed resminya shopee dan aplikasi shopee yaa. Kalo ada kendala/pertanyaan lainnya bisa DM ke Social Media kita @shopee_id/@shopeecare_id. Sehat selalu ^ON",04/14/2025 10:07,
235461c1-2900-4ab6-99bb-2e7235d30bce,Wily Agdi,https://play-lh.googleusercontent.com/a-/ALV-UjXOzAzvJMVzJPNzSmpqHaWMuX6EYdeuP6LLSlOLHHv-E1Tz9cqX,alhamdulilah lancar,5,0,7.39.0,04/14/2025 9:35,"Haii kak Wily Agdi, makasih yaa buat review bintang 5 nya, yuk pantengin terus updatean dari sosmed resminya shopee dan aplikasi shopee yaa. Kalo ada kendala/pertanyaan lainnya bisa DM ke Social Media kita @shopee_id/@shopeecare_id. Sehat selalu ^ON",04/14/2025 10:10,7.39.0
0eb90b62-4e92-453f-9654-52adb5cef17a,catur kristianto,https://play-lh.googleusercontent.com/a/ACg8ocKGx-HgfJVW06RBwq7x0yO49idq63q-8iCxA7JQ6pX8ULdDvg=mo,mantap,5,0,7.39.0,04/14/2025 9:26,"Haii kak catur kristianto, makasih yaa buat review bintang 5 nya, yuk pantengin terus updatean dari sosmed resminya shopee dan aplikasi shopee yaa. Kalo ada kendala/pertanyaan lainnya bisa DM ke Social Media kita @shopee_id/@shopeecare_id. Sehat selalu ^ON",04/14/2025 10:09,7.39.0
d8ce628a-1359-40d1-a89c-3704d13c504e,Riza Maulana,https://play-lh.googleusercontent.com/a/ACg8ocIyERpH0-4DKGQUOGnYn9WasHmSFnLomBc7LG3V6F7tt5YvCg=mo,driver di paksa menjalankan 2 orderan sekaligus terus ongkir nya pun di potong setiap dapat dobel order.yg seharusnya dapat 16 000 per 2 orderan sekarang cuman 11 000,1,2,7.39.0,04/14/2025 9:17,"hai kak, maaf udah bikin kamu ganyaman. terkait kendala kamu  mohon infokan detail kendala dan username akun kamu ke mimin melalui DM resmi sosmed shopee atau livechat pada aplikasi shopee kamu ya kak. mimin tunggu 🙏 ^AX",07/07/2024 5:29,7.39.0
93ad02d3-339b-4234-8830-99317844170c,Evoss Id,https://play-lh.googleusercontent.com/a/ACg8ocIcwRX7fGeozxwexwZMzFlDIvRAiSlJ6OSDBGF76C7zIBbo2A=mo,"Aplikasi Gila ga punya hati nurani, ga punya pikiran sehat, 3 hari suspen baru jalan 3 hari di suspen lagi,,, hey pihak shope yg terhormat,, kami makan tuh sehari 3 kali bukan 3hari sekali,, tolong pikir kan dengan baik jangan se enak nya kasih penalti,,, saya sudah memaksakan diri jika mendapat kan orderan ngebles ,,",1,0,,04/14/2025 9:03,"Haii kak Evoss Id, maaf sudah bikin tidak nyaman terkait kendala yang kamu alami. Agar aku bisa bantu cek boleh infoin ID Deiver kamu ke DM Social Media kita @shopee_id/@shopeecare_id. Sehat selalu ^ON",04/14/2025 10:28,
169307f2-d48e-4145-95a2-177f02649104,Nanang Bagus arianto,https://play-lh.googleusercontent.com/a/ACg8ocKcB7jpUHT7r8gKPv5OZlTstXRKf5M4EBr5R2zZvhSxdPysPw=mo,terlalu banyak driver tp sepi pesanan jadi males tambah lama bukan tambah menghasilkan malah buang buang waktu semoga bisa lebih baik Lg,1,0,,04/14/2025 9:00,"Hi kak Nanang Bagus arianto, maaf banget ya udah buat kakak ga nyaman. terkait kendala sepi order yang kakak alami, makasih ya kak terkait masukan dari kamu, akan aku jadikan acuan untuk menjadikan Shopee lebih baik lagi. jika kakak ada pertanyaaan bisa DM aku ke Social Media @Shopee_id / @shopeecare_id ya. Stay Healthy  ^RL",04/12/2025 9:28,
665383bf-7243-4a09-8770-f0b8e454af5c,Nano Iskandar,https://play-lh.googleusercontent.com/a/ACg8ocKQGpzxmXEfDfAsujTPL41ygC9JAC0E6GSy2xj6lnfBKFmvJQ=mo,driver selalu salah . walau toko tutup lalu dicancel . terus kalau toko tutiup harus nunggu sampai buka gitu,1,2,7.39.0,04/14/2025 8:59,"Hai kak Nano, maaf buat ketidaknyamananya. Terkait feedback dari kakak akan dijadikan evaluasi agar pelayanan dan juga performa aplikasi Shopee semakin lebih baik lagi ke depan nya. Agar aku bisa bantu lebih lanjut boleh infoin no pesanan dan ID driver melalui DM @Shopee_id / @ShopeeCare ya. Aku tunggu kak ^CJ",04/14/2025 9:17,7.39.0
4805bd5f-c2b6-434b-b58d-8bee7e968483,Mr. Y,https://play-lh.googleusercontent.com/a-/ALV-UjVWTq1LWX8p6-do2tZhF2EAzNKTjYESH1JzEUN2Vk91jSTdWiH11g,"Gajelas banget, saya posisi sudah di daerah Sukomanunggal malah dapat orderan daerah Dinoyo yang jarak tempuhnya sekitar 7KM. ongkos kirim juga murah banget, ga sepadan dengan jarak yang ditempuh. TOLONG PIHAK SHOPEE PERBAIKI LAGI SISTEMNYA🙏🏻",1,8,7.39.0,04/14/2025 8:48,"Hai kak Mr. Y, maaf buat ketidaknyamanannya. Terkait feedback dari kakak akan dijadikan evaluasi agar pelayanan dan juga performa aplikasi Shopee semakin lebih baik lagi ke depan nya. Kami berusaha agar para pengguna nyaman menggunakan shopee. Kalo ada pertanyaan, langsung hubungi aku via DM @Shopee_id / @ShopeeCare ya. Sehat selalu kak ^CJ",04/14/2025 9:12,7.39.0
b844d2b4-36eb-403b-a58d-ab1dca40a19c,Dody Hary,https://play-lh.googleusercontent.com/a-/ALV-UjX8Q_b0pUcRCd0DL2FnNY8cP_2K-V9J0fnIWMAoFnPHWvySeAk,"Dear IT Shope, minta bantu update untuk system pilihan orderan, seperti di grab atau gojek biar enak, kalo bisa tambah shopee bike biar makin gacor nih akun. semoga tersampaikan ulasan saya. terima kasih.",4,125,7.39.0,04/14/2025 8:46,"Hai kak Dody, terimakasih buat review dan bintangnya. Terkait feedback dari kakak akan dijadikan evaluasi agar pelayanan dan juga performa aplikasi Shopee semakin lebih baik lagi ke depan nya. Kami berusaha agar para pengguna nyaman menggunakan shopee. Kalo ada pertanyaan, langsung hubungi aku via DM @Shopee_id / @ShopeeCare ya. Have a nice day ^CJ",04/14/2025 9:11,7.39.0
a7ad5c5e-e5e4-4da9-87d7-d4cae73ab0f7,Hasta karya Stone,https://play-lh.googleusercontent.com/a-/ALV-UjUS6JLLNXka9J4FiLFvZZoxbgdNyyjB0fIpQAytFH7_D5QQEAhe,aplikasi eror,1,1,7.39.0,04/14/2025 8:44,"Hi kak Hasta, maaf udah bikin ga nyaman terkait apk eror. Aku saranin km buat pastiin udah update aplikasi dan jaringan km stabil, Clear Cache pd aplikasi Shopee, Log out serta Log in kembali, dan bisa coba secara berkala 1x24 jam. Jika msih terkendala km bs DM Sosmed kita @Shopee_id / @Shopeecare ya.^CJ",04/14/2025 9:10,7.39.0
3bc0bf49-1339-4fc6-83af-cf3a1130b8a5,Teguh Ari,https://play-lh.googleusercontent.com/a/ACg8ocI8yHjNE45i3aKek518AiwUzys2iiPBQnP1j_1sYkDZfrnIUg=mo,"shope perbaiki lah sistem driver dan argo, apalagi sameday jangan menyiksa driver",1,1,7.40.1,04/14/2025 8:24,"Hai kak Teguh Ari, maaf buat ketidaknyamananya. Terkait feedback dari kakak akan dijadikan evaluasi agar pelayanan dan juga performa aplikasi Shopee semakin lebih baik lagi ke depan nya. Kalo ada pertanyaan atau kendala bs langsung hubungi aku melalui DM @Shopee_id / @ShopeeCare ya. Sehat selalu kak ^CJ",04/14/2025 9:21,7.40.1
ac28f681-58c6-43ea-a1e7-254a3d98a7bb,Andi irfan Ipank,https://play-lh.googleusercontent.com/a/ACg8ocIBF4Q_gxgqk6X7Uaa30HPB3Tn0DDITqDTf0hlqM605LVZ1VQ=mo,sangat bagus,5,0,7.39.0,04/14/2025 7:34,"hai kak Andi irfan Ipank, thanks buat 5 bintang dan reviewnya. semoga kakak selalu happy belanja kebutuhan dan bertransaksi di shopee. pantau terus aplikasi dan sosmed shopee biar kakak nggak ketinggalan promo yg ada di shopee. kalau ada kendala terkait shopee bisa langsung DM IG @shopee_id. Happy shopping ^NO",04/14/2025 8:32,7.39.0
f6c34bf8-603d-424e-a5d0-b1fa0509b578,Syaiful Rahmat,https://play-lh.googleusercontent.com/a/ACg8ocKe84y_pHMQjgo4YGnDydIDrmozTFAWZDRSfT2Ks05u3pGZ=mo,"sistemnya masih berantakan dikit² suspen orderan dibawa kena suspen orderan ga dibawa kena suspen suspen dengan alasan, ""MEMILIKI TINGKAT PENYELESAIAN RENDAHH """,1,3,7.39.0,04/14/2025 7:00,"Hai kak Syaiful Rahmat, maaf ya udah bikin kakak nggak nyaman terkait kendala yg kakak alami. supaya aku bisa bntu cek, kakak boleh infoin detail dan SS kendala kakak,username shopee. di DM IG shopee_id ya kak. stay safe ^NO",04/14/2025 8:24,7.39.0
aa247be9-77d2-4a6b-a2c1-ccfcdbe1ff0f,Agus rudi Fahrizal,https://play-lh.googleusercontent.com/a-/ALV-UjVm8ryYhCuGqT0mkpUTOV8BbE9-2cpdQMjUy5vrY6D_O55Z_Nav,"aplikasi tolol nyusahin driver, dikit dikit Suspen. benahin lagi tuh sistem jangan mentang mentang gampang buka lowongan driver juga gampang buat di putus mitra dan tolong benahin lagi argonya",1,3,7.39.0,04/14/2025 6:31,"Hai kak Agus rudi Fahrizal, maaf ya udah bikin kakak nggak nyaman terkait kendala yg kakak alami. supaya aku bisa bntu cek, kakak boleh infoin detail dan SS kendala kakak,username shopee. di DM IG @shopee_id ya kak. stay safe ^NO",04/14/2025 7:31,7.39.0
dd2025ff-2f00-4ede-92d2-b54ba0f889b0,misquin gaming,https://play-lh.googleusercontent.com/a/ACg8ocKTxJJj87BLlkjc_EFIki7SCEDXNbTUXUZsNHmkhMiBPGBu-g=mo,tlp ke penerima pake apliksi jgn pke pulsa uda ongkos dikit potong pulsa,1,2,7.40.1,04/14/2025 6:05,,,7.40.1
0713c119-229e-4f6e-b836-d55cd9091a93,Arfandi Fandi,https://play-lh.googleusercontent.com/a-/ALV-UjU1Ys-n8b7zAx_akbr8zMRdfIU9IPk66De_hHsVtd9mYtn5_5DA,apk kluar kluar muluuu,1,1,7.39.0,04/14/2025 5:25,"hai kak Arfandi Fandi. aku saranin lakukan clear cache di perangkat Kakak kemudian coba akses kembali secara berkala ya. Pastiin juga aplikasi Kakak udah diperbarui ke versi baru di Play Store / Google Play.kalau ada pertanyaan atau kendala terkait shopee, bisaa langsung chat aku ya di DM IG @shopeecare_id. have a nice day ^NO
",04/14/2025 6:28,7.39.0
d37ce2d7-e7c2-4301-92fa-185815f41ba9,Andi Setiawan,https://play-lh.googleusercontent.com/a-/ALV-UjUZXYqBWPmHuN6aemwqXKQ4B-xom6S-w7RDV_j_DGSLuySGFGHA,harap ditambahkan fitur order se arah agar kita driver kalau kirim luar kota bisa dpat order balik lgi ke kota asal biar G buang BBM banyak,4,0,7.39.0,04/14/2025 5:24,"hai kak Andi Setiawan, Sistem kami secara otomatis mengatur pengantaran pesanan yang bisa dilakukan sekaligus agar dapat mencarikan Mitra Pengemudi terdekat yang dapat segera menyelesaikan pesanan Pelanggan secara efisien sesuai dengan estimasi waktu pengantaran. kalo ada kendala terkait shopee, bsa langsung chat di DM IG @shopee_id dan ^NO",04/14/2025 6:17,7.39.0
61d16428-8f22-4e90-8be8-09a18a36119c,Febry Tholle,https://play-lh.googleusercontent.com/a/ACg8ocKlwwAqUdeDN45kelg10orpJMRvyXI56m8-0kIQCkgaRombeQ=mo,"tolong kembali sistem awal ,sebelum dipegang kjn spx nya,awal belum lama dulu jarak 20km mesti diatas 40rb barusan antar sama 20km cuma 36rb",2,1,7.38.0,04/14/2025 5:19,"Hai kak Febry Tholle, maaf ya udah bikin kakak nggak nyaman terkait kendala yg kakak alami. supaya aku bisa bntu cek, kakak boleh infoin detail dan SS kendala kakak,username shopee. di DM IG shopee_id ya kak. stay safe ^NO",04/14/2025 6:36,7.38.0
8c54ea9b-ef49-4293-aff4-75eacb474b11,Ranger Merah,https://play-lh.googleusercontent.com/a-/ALV-UjXPGt1vplBxHqaXUQ4bneSRwUXsqpjjoJVk4cnnblDeObeuNM0,mending narik aplikasi sebelah🤣,1,0,,04/14/2025 4:59,,,
ee9c140f-55c9-49cd-9b0f-d5a9c487f813,arif shinichi,https://play-lh.googleusercontent.com/a/ACg8ocLUeUcLCH_KKB0QY5qLg5tVl2PrY-AOfnCVHQiShW6gAJJeSA=mo,"tolong perbaiki maps mu masak jarak resto puluhan kilo dari saya (driver) masih bisa nyantol ke akun saya gak beres banget sistem mu kalau kayak gini, siapa yg rugi? akun kena tahan",1,1,7.38.0,04/14/2025 4:55,"Hai kak, terima kasih ya untuk feedbacknya. Kedepan shopee akan terus berusaha lebih baik lagi agar para pengguna lebih nyaman dalam menggunakan shopee. Klo ada pertanyaan/kendala, kaka bisa hubungi DM Social Media @Shopee_id /@Shopeecare_id ya. Sehat selalu ^ED",01/23/2025 5:42,7.38.0
0367cdae-da52-4517-8fcc-618b5757fca1,Heru Gaming,https://play-lh.googleusercontent.com/a-/ALV-UjVD7EAMTmhHvyknZdhteG5sfD9S3gylu1RJdvXv6f4Gws6C8UdQ,"spx lagi eror beberapa hari ini masak iya jam 1 dapat spx, di datengi kok kok tokohnya tutup gk jelas amat",2,0,7.39.0,04/14/2025 4:54,"Hi kak Heru Gaming, maaf ya udah buat kakak ga nyaman terkait Shopee. Semoga kedepannya Shopee bisa memberikan yg terbaik utk pengguna. Namun, jangan khawatir, agar bisa aku bantu cek lebih lanjut, bisa infoin detail kendala kamu melalui DM Instagram @shopee_id atau @shopeecare_id ya kak. Terima kasih ^SX",04/14/2025 5:29,7.39.0
58fd2eef-6b7a-417e-b71f-8ee8643b1833,Kizuna Red,https://play-lh.googleusercontent.com/a/ACg8ocIeYBJ8Qn79TGzhF-j_FL1W5Q9--2usGrstRaNoNcDHGRPYSg=mo,- bug makin banyak - titik lokasi sering tidak sesuai - fitur untuk membintang customer / resto belum ada - jarak pengambilan pesanan yang sampai 2.5/3KM tolong perbaiki itu semua,1,3,7.39.0,04/14/2025 4:38,"Hi kak  Kizuna Red, maaf ya udah buat kakak ga nyaman terkait Shopee. Semoga kedepannya Shopee bisa memberikan yg terbaik utk pengguna. Namun, jangan khawatir, agar bisa aku bantu cek lebih lanjut, bisa infoin detail kendala kamu melalui DM Instagram @shopee_id atau @shopeecare_id ya kak. Terima kasih ^SX",04/14/2025 5:28,7.39.0
882ba2c9-d882-423f-b9a6-89c7f4482481,Yusuf Ar Rasyid,https://play-lh.googleusercontent.com/a-/ALV-UjXh9lMxVsn0Bb07KXidTsUZXBguQBYeLGefhx0jW6ZCo5kQ3lm_,"navigasinya kenapa tidak dibuat sendiri , mislanya seperti Grab menyediakan Grabmap, karena terintegrasi jadi lebih mudah melihat lokasi tujuan dan tidak perlu loading direct ke aplikasi map yg terpisah, semoga bisa di upgrade untuk kemudahan penggunaan",4,0,,04/14/2025 4:22,"Hi kak  Yusuf Ar Rasyid, maaf ya udah buat kakak ga nyaman terkait Shopee. Semoga kedepannya Shopee bisa memberikan yg terbaik utk pengguna. Namun, jangan khawatir, agar bisa aku bantu cek lebih lanjut, bisa infoin detail kendala kamu melalui DM Instagram @shopee_id atau @shopeecare_id ya kak. Terima kasih ^SX",04/14/2025 5:27,
2ae63d5c-02d1-400c-93c8-8bb90219b9bb,Abdul Azis,https://play-lh.googleusercontent.com/a/ACg8ocL1cHIjYF-IT-YZak2lr5hZvxJnXPnUSMFORJ69XWw3hR2kQw=mo,semoga di acc jadi mitra nya,5,0,7.39.0,04/14/2025 4:11,"Hi kak  Abdul Azis, makasih buat review bintang 5 nya, yuk cek aplikasi Shopee biar ga ketinggalan promo-promo menarik lainnya biar tambah semangat belanjanya. kalo ada pertanyaan bisa chat aku dengan memberikan screenshot review ini melalui DM ke Instagram @shopee_id atau @shopeecare_id yaa. Terima kasih ^SX",04/14/2025 5:25,7.39.0
f44a80a1-1eb1-48e9-a3c3-1811bd5fcc9c,Gon Zizi,https://play-lh.googleusercontent.com/a/ACg8ocJ482r7tQlVhC01bl6hKxUqLT627e28brFWwGr3AK1PwqHbEQ=mo,"SEMAKIN HARI ONGKOS DGN JARAK YG SEMAKIN TIDAK MASUK AKAL, TAMBAH LAGI TITIK DRIVER MASUK ORDERAN DGN TITIK PENGAMBILAN YG TERLALU JAUH DN TIDAK MASUK AKAL JARAKNYA tolong ya masalah parkir di perjelas, harusnya sdh otomatis masuk ke bill customer, jadi driver tidak menagih manual, karena banyak customer yang gak mau kalo parkir tu jadi tanggungan mereka",2,4,7.40.1,04/14/2025 4:07,"Hai kak, mohon maaf ya udh buat kakak kecewa. Feedback dri kakak akan kami jadikan masukkan agar kedepannya Shopee selalu memberikan pelayanan yg terbaik utk semua pengguna ya kak. Terimakasih ^BW",04/03/2025 12:21,7.40.1
467eb37c-74ba-40a5-9a4d-c0649d2b3f3c,Moch Dano,https://play-lh.googleusercontent.com/a-/ALV-UjVI49nMNE4Ylvtm35qLoUOVGDEL6z725BXfU18VwLhJo2bYUzpH,ini aplikasi kenapa gak bisa dimatiin dilatar belakang dah? aplikasi gak dipakek pun keterangan nya tetap aplikasi sedang berjalan aneh 😐,3,0,7.39.0,04/14/2025 4:01,"Hi kak Moch Dano, maaf ya udah buat kakak ga nyaman terkait Shopee. Semoga kedepannya Shopee bisa memberikan yg terbaik utk pengguna. Namun, jangan khawatir, agar bisa aku bantu cek lebih lanjut, bisa infoin detail kendala kamu melalui DM Instagram @shopee_id atau @shopeecare_id ya kak. Terima kasih ^SX",04/14/2025 5:31,7.39.0
242e2862-757b-4e7a-bbaf-7bf5d52a1480,Syaiful azhar Lubis,https://play-lh.googleusercontent.com/a-/ALV-UjVQcURfa8wJ3Nda-qWib-AS5YTvk7ER5flh2r0wKQwf9N1KJVPX,ok,5,0,7.39.0,04/14/2025 3:44,Hai kak Syaiful azhar Lubis makasih ya buat reviewnya. Yuk kepoin update-an dari sosmed resminya shopee dan aplikasi shopee yaa. Jangan sungkan chat aku di dm IG @shopeefood_id ya kalo kakak ada pertanyaan atau kendala seputar shopee yaa. Have a nice day ^NZ,04/14/2025 4:29,7.39.0
