reviewId,userName,userImage,content,score,thumbsUpCount,reviewCreatedVersion,at,replyContent,repliedAt,appVersion
338ff557-f8bd-42e8-8fd6-581fb1a10a26,doddy agung,https://play-lh.googleusercontent.com/a-/ALV-UjU1f25wObStXS_eZo9QI58Bhci1KlUll7OubSz8mXRA69EFeKdE,"saya dapat orderan SPX malam hari pada tanggal 12 april 2025, lalu saya ambil ke toko nya, katanya sudah pesan driver dari sore sedangkan saya baru dapat malam, setelah itu saya antarkan ke rumah customer, saya ketok2 gk ada balasan dari dalam rumah soalnya sudah sangat malam, lalu saya taruh di teras rumah customer, lalu saya kirim pesan bahwa sudah saya taruh depan, lah kok hari ini tanggal 17 april akun saya kena poin 100 dengan alasan tidak mengantar pesanan pada customer.",1,2,7.39.0,04/17/2025 10:30,"Hai kak doddy agung, maaf ya untuk kendala yang kaka alami, terkait kendala kakak, agar aku bisa bantu cek lebih lanjut, kakak bisa chat detail kendala kakak ke DM Social Media kita @Shopee_id /@Shopeecare_id ya, Sehat selalu ^BS",04/17/2025 11:11,7.39.0
348c5213-b093-4d0c-98cd-b69c71824a64,Kiki Kurnia,https://play-lh.googleusercontent.com/a/ACg8ocIdoAe9NC01uNQSTdjaXbCkBUk-Qj8vMgwvipyw_iMXL56xJw=mo,mantap sekali,5,0,7.40.1,04/17/2025 10:27,"Hai Kak Kiki Kurnia, makasih ya buat penilaiannya, semoga Shopee terus bisa kasih pelayanan yg terbaik buat kakak. Shopee juga akan terus tingkatkan pelayanan yg terbaik biar kakak makin nyaman, aman dan asik belanja/bertransaksi di Shopee. yuk pantengin terus sosmed shopee biar kakak tahu update info promo menariknya. Have a Nice day ka^BS",04/17/2025 11:09,7.40.1
ca4db0ae-43dd-41e8-a658-81cd24e0b7e6,Ojol86 Grabbike,https://play-lh.googleusercontent.com/a/ACg8ocIjpZwCGBSwAZwM0eTduXy8qZOM9h8PeQkPJ2pR96lEHIXWDA=mo,hapus poin/suspend wkt keadaan mendesak dicancel ordern mitramu itu bkn robot tp manusia!!contoh donk grab & gojek tdk dikit2 akun ditahan.,1,0,,04/17/2025 10:26,"Hai kak Ojol86 Grabbike, maaf ya untuk kendala yang kaka alami, terkait kendala kakak, agar aku bisa bantu cek lebih lanjut, kakak bisa chat detail kendala kakak ke DM Social Media kita @Shopee_id /@Shopeecare_id ya, Sehat selalu ^BS",04/17/2025 11:08,
1ec7bda2-858b-4e13-8e87-bc050665212b,Fathul Alamsyah,https://play-lh.googleusercontent.com/a/ACg8ocJ1ak6cCXUTfqHRkLJkbVfQnugkci4jrHCgxL5O0Wz0tADWIQ=mo,mau mutasi aja ribet harus ada surat domisili,1,0,7.35.0,04/17/2025 10:22,"Hai kak Fathul Alamsyah, maaf ya untuk kendala yang kaka alami, terkait kendala kakak, agar aku bisa bantu cek lebih lanjut, kakak bisa chat detail kendala kakak ke DM Social Media kita @Shopee_id /@Shopeecare_id ya, Sehat selalu ^BS",04/17/2025 11:08,7.35.0
9a10608c-248c-484e-9949-92f857fcf1fd,Muhammad Gian,https://play-lh.googleusercontent.com/a/ACg8ocI8X1CgDObkjyeoSBra8IBAKu3yJU6kLMeCKyLhXxo3AeXd8g=mo,"setiap habis pembaruan akun jadi anyep dan bodoh,ketauan x distel dari sananya...",1,15,,04/17/2025 10:17,"Hai kak Mohon maaf atas sepi order. Kami pastikan bahwa tidak ada yang salah dengan akun kamu. Kami sampaikan bahwa alokasi pesanan secara otomatis diatur oleh sistem, sehingga CS tidak dapat mengatur hal tersebut. Tapi kami bisa berikan beberapa sara melalui link berikut ini https://help.shopee.co.id/portal/article/72072 semoga sehat selalu 🙏 ^HE",05/20/2024 11:22,
ff319f37-3ef5-477c-9d47-4f5ac973b71f,Diah Rianti,https://play-lh.googleusercontent.com/a/ACg8ocKk7JlwU-r3Czp1WzY_BracXouvCRX0PD8SVdEx_7No020F9g=mo,"Aplikasi Cengeng Apa apa Suspen apa apa maen poin,Semenjak Di pegang pihak Ke 3 KJN argo makin ga ngotak,Bukannya di perbaiki lebih baik ini malah Jauh Dari kata baik,,Lain kali turun ke lapangan Biar tau kondisi para driver,jngn cuma bisa mantau dari monitor aja!!!",1,3,7.40.1,04/17/2025 9:43,"Hai kak Diah Rianti, maaf ya untuk kendala yang kaka alami, terkait kendala kakak, agar aku bisa bantu cek lebih lanjut, kakak bisa chat detail kendala kakak ke DM Social Media kita @Shopee_id /@Shopeecare_id ya, Sehat selalu ^BS",04/17/2025 10:16,7.40.1
3b1523c1-e0e8-4cb4-b3eb-b460bcc8ad94,Teni Komariah,https://play-lh.googleusercontent.com/a/ACg8ocJB7c9ee0-JyiLrLuSL_FIJfQA-QmnJkboxnDULGv-fZmk35A=mo,perbaiki lagi sistem sama ongkir boy,1,2,,04/17/2025 9:36,"Hai kak Teni Komariah, maaf ya untuk kendala yang kaka alami, terkait kendala kakak, agar aku bisa bantu cek lebih lanjut, kakak bisa chat detail kendala kakak ke DM Social Media kita @Shopee_id /@Shopeecare_id ya, Sehat selalu ^BS",04/17/2025 10:15,
75c4c692-f579-48cc-b76d-213cfaa78f08,budi santoso,https://play-lh.googleusercontent.com/a/ACg8ocLucyUWJ9fsJ2KGOabDC-HXw4hqulza2C8aBGXyr0TeLq_Bmw=mo,bgus,5,0,7.40.1,04/17/2025 9:36,"Hai Kak budi santoso, makasih ya buat penilaiannya, semoga Shopee terus bisa kasih pelayanan yg terbaik buat kakak. Shopee juga akan terus tingkatkan pelayanan yg terbaik biar kakak makin nyaman, aman dan asik belanja/bertransaksi di Shopee. yuk pantengin terus sosmed shopee biar kakak tahu update info promo menariknya. Have a Nice day ka^BS",04/17/2025 10:28,7.40.1
4947a9fc-7306-4c46-8c0c-9e0ba633c1cf,Alfath Beriyan,https://play-lh.googleusercontent.com/a-/ALV-UjWLefNYSgiD1dT9hV4O4I_Pif2q-3wjPBqlydcIHAlA53i45kBx,"1. tambahkan fitur memilih jenis orderan mau food atau SPX! 2. tambahkan maps seperti si ijo di tampilan awal! 3. SPX terutama sameday di perbaiki lagi. jarak ga ngotak antara satu toko dg toko lainnya. masa saya perjalanan 250an km dibayar cuma 150 sedangkan waktu, tenaga dan bensin habis.",1,1,,04/17/2025 9:33,"Hai kak Alfath Beriyan, maaf ya untuk kendala yang kaka alami, terkait kendala kakak, agar aku bisa bantu cek lebih lanjut, kakak bisa chat detail kendala kakak ke DM Social Media kita @Shopee_id /@Shopeecare_id ya, Sehat selalu ^BS",04/17/2025 10:27,
aa8b6d31-6d25-4075-856b-93b358da07e5,Kampret Malakian,https://play-lh.googleusercontent.com/a-/ALV-UjWwSFTiRnxRCUw2Sx-0a91p-aStpCqNCblYjjWaDgRO1iyGZYM4,habis update map malah eror 🤣🤣🤣🤣,2,0,7.39.0,04/17/2025 9:28,"Hai kak Kampret Malakian, maaf ya untuk kendala yang kaka alami, terkait kendala kakak, agar aku bisa bantu cek lebih lanjut, kakak bisa chat detail kendala kakak ke DM Social Media kita @Shopee_id /@Shopeecare_id ya, Sehat selalu ^BS",04/17/2025 10:13,7.39.0
5c410bbf-973d-46c1-a874-1977157c0b17,aku icam (Bang Icam),https://play-lh.googleusercontent.com/a-/ALV-UjWebbt7zu1RZvdQS6FmeNqLXHoVLU8RvTq7j0_UNKctkvEwFfv5,"tolonglah kaya sebelah, bisa matiin layanan spx, samday atau food, biar kerja bisa flexible :)",1,1,,04/17/2025 9:27,"Hai kak aku icam (Bang Icam), maaf ya untuk kendala yang kaka alami, terkait kendala kakak, agar aku bisa bantu cek lebih lanjut, kakak bisa chat detail kendala kakak ke DM Social Media kita @Shopee_id /@Shopeecare_id ya, Sehat selalu ^BS",04/17/2025 10:12,
1720e63e-184b-4733-9f2f-e63af314c37e,Siswandi Wandi,https://play-lh.googleusercontent.com/a-/ALV-UjXSxnqcsqF9UN1gy2AdGr-PCgL-uXAI8IVdjugt49XramFi0bE,Makin ke sini orderan makin anyep..sehari cuma dpt 2 -3 order..haduh kacau Shopee..tambah spx gabungan argo membagongkan.. nyuruh driver sengsara..,1,2,7.40.1,04/17/2025 9:19,,,7.40.1
9c10ed13-68e5-4dde-bd17-36eb893bfde4,Lhim,https://play-lh.googleusercontent.com/a/ACg8ocIe6YrO14nGyrgOM1VCHEM4MLI4OT1ie8bgZVdp59tOCYYeoA=mo,anyep bngt sumpah,1,2,7.40.1,04/17/2025 8:51,"Hai kak Lhim. Maaf terkait kendala sepi order. Aku infoin bahwa alokasi pesanan secara otomatis diatur oleh sistem, sehingga CS tdk dpt mengatur hal tsb. Aku saranin Kakak dapat perhatikan saat sedang bekerja melalui link berikut ini: https://help.shopee.co.id/portal/article/72072. Jika ada kendala bs hub di DM IG @Shopeefood_id. Terima kasih ^NW",04/17/2025 9:35,7.40.1
fb33db52-e214-416c-968a-ac21b615a5c3,Gombez Bez,https://play-lh.googleusercontent.com/a/ACg8ocJFdf5j5PsIRB61euSFAsFv-XAB975NabegxknPbNkq3l7lVg=mo,lonjakan gak pernah ada,4,0,7.40.1,04/17/2025 8:51,Hai kak Gombez Bez. Maaf terkait kendala yang kakak alami. Terkait kendala kakak akan kami jadikan sebagai evaluasi demi kebaikan ShopeeFood kedepannya. ShopeeFood akan selalu berusaha memberikan yang terbaik kepada seluruh penggunanya. Kalau kakak ada pertanyaan/ kendala boleh infoin di DM IG @Shopeefood_id. Terima kasih ^NW,04/17/2025 9:53,7.40.1
3cc04873-35bf-4151-bea3-8b0749f33361,Siprianus Malo,https://play-lh.googleusercontent.com/a/ACg8ocJt-NaV0IYnTKvnuoiNJazHY4DKmgPRB-rFZx7hisX39qDKTnU=mo,kurang gacor,1,1,7.40.1,04/17/2025 8:43,"Hai kak Siprianus Malo. Maaf terkait orderan ShopeeFood. Aku infoin alokasi pesanan secara otomatis diatur oleh sistem, sehingga CS tdk dpt mengatur hal tsb. Aku saranin Kakak dpt perhatikan saat sedang bekerja melalui link berikut ini: https://help.shopee.co.id/portal/article/72072. Jika ada kendala bs hub di DM IG @Shopeefood_id. Terima kasih^NW",04/17/2025 9:46,7.40.1
2e379d04-886b-4963-aed6-63029e0feb20,Hasan Riski,https://play-lh.googleusercontent.com/a-/ALV-UjWYDGCuf4QTiTOMcNPl41d8sj0bRp23UhEVqjOdI0xwMMkzbFB7nA,Memuaskan,4,0,7.40.1,04/17/2025 7:56,"Hallo kak, maaciiw yaah untuk review nya, yuk pantau terus update-update dari Shopee melalui sosial media resmi Shopee dan aplikasi Shopee ya kak. Sehat selalu ^ZZ",12/16/2024 6:18,7.40.1
a5861f11-e4ca-4006-a9be-d494b37ac828,Ari yadi,https://play-lh.googleusercontent.com/a-/ALV-UjWmb0HfcjnsugjThZxB2nzunBJFf2X-_hGv7ktZ1pulhOdL7beL,bagus,5,0,7.40.1,04/17/2025 7:55,"Hi kak Ari yadi  , makasih banyak ya untuk review dan bintangnya. aku ikut seneng deh kalo kakak suka dengan fitur dan pelayanannya. Jika kakak ada kendala atau pertanyaan terkait shopee kakak bisa hubungi aku di DM ke Social Media kita @Shopee_id/@ shopeecare_id/shopeepay_id ya. Terima kasih telah menghubungi shopee ^XR",04/17/2025 8:35,7.40.1
02669eab-be9f-46d1-b5b8-1fc0e5c69bfb,Galank Koelana putra,https://play-lh.googleusercontent.com/a-/ALV-UjVBA3zhkZsmhWKpWSdEDVI78zGg47HKBzASJPUUKjD5Ka4pnOkj,"bisa gak sih orderan sameday nya kayak yg sebelah arahnya bener,lah ini shoppe ya allah jaraknya jauh2 ngambil paket,ambil dan antar nya acak2an dan argonya tolonglah lbh MANUSIAWI KAWAN",2,1,7.40.1,04/17/2025 7:38,"Hai kak Galank Koelana putra  , mohon maaf atas ketidaknyamanannya . Biar bisa aku bantu pengecekan, Boleh infoin detail kendala  ke DM Social Media kita @Shopee_id/@ shopeecare_id/shopeepay_id ya. Terima kasih telah menghubungi shopee ^XR",04/17/2025 8:35,7.40.1
5fa2fbb3-34e2-4106-a498-7de73aba3630,Erlan Maulana,https://play-lh.googleusercontent.com/a/ACg8ocIJPtIMQIbaWbFbrFxI-iBxrO9ufdm4_DlTl0DV1osgDXe_bw=mo,"kenapa yg lain ada notif bonus yg 60 trip di akun sy tidak ada, harunya kan merata",3,8,7.40.1,04/17/2025 7:34,"Hai kak Erlan Maulana  , mohon maaf atas ketidaknyamanannya . Biar bisa aku bantu pengecekan, Boleh infoin detail kendala  ke DM Social Media kita @Shopee_id/@ shopeecare_id/shopeepay_id ya. Terima kasih telah menghubungi shopee ^XR",04/17/2025 8:33,7.40.1
7a999be9-29a8-494a-8cd8-2655fc06ec4d,mari yanto,https://play-lh.googleusercontent.com/a-/ALV-UjVvb62Z8HhRWymPa71n0mMrVP-yHgUQmQGYJ4lOkthP-608VVA,bagus lah.....,5,1,7.35.0,04/17/2025 7:04,"Hi kak mari yanto,  makasih banyak ya untuk review dan bintangnya. aku ikut seneng deh kalo kakak suka dengan fitur dan pelayanannya. Jika kakak ada kendala atau pertanyaan terkait shopee kakak bisa hubungi aku di DM ke Social Media kita @Shopee_id/@ shopeecare_id/shopeepay_id ya. Terima kasih telah menghubungi shopee ^XR",04/17/2025 8:32,7.35.0
e6db5035-7786-4085-87b2-ff099abe04ca,Muhammad Hardiansyah,https://play-lh.googleusercontent.com/a-/ALV-UjXaRQw69DLN2SggS84pjZAJTa4xUDHLANxCLQazqIvuWgHSLwo,"dikit dikit Suspen dikit dikit Suspen, mending kalo di Suspen keterangan nya jelas, lah ini baru juga narik selesai nganter orderan pertama langsung dapet peringatan penyelesaian rendah kan aneh....sameday juga Argo nya parah total 85km an masa Argo cuma 140",1,6,7.40.1,04/17/2025 6:50,"Hi Kak Muhammad Hardiansyah, Maaf ya untuk kendalanya.  Aku bantu infoin Kakak alokasi pesanan secara otomatis diatur oleh sistem ya kak. namun agar aku bisa cek lebih lanjut kakak bisa hubungi aku di DM Shopeecare_id yang ada centang birunya. Stay Healthy ^BQ",02/24/2025 8:21,7.40.1
a12751ee-3d10-425f-89c0-4033b0b2395c,Muhammad Saepulloh,https://play-lh.googleusercontent.com/a-/ALV-UjWKJr-j9Oukfty9hXgnOKB9mNqR9IDs7jXHVDaC-sVYQA_w1cc,"ongkos nya tidak manusiawi, kalo di cancel kena point penalty .. driver di tuntut untuk kerja..kerja..kerja, bodo amat resiko di lpangan gmna",1,1,7.39.0,04/17/2025 6:27,,,7.39.0
e8d5548b-1a17-42a4-926d-c92f3934ccca,Ahmadi Subroto,https://play-lh.googleusercontent.com/a/ACg8ocJkNIRd21IGVrxo1smF5Aibqu5E2Pyw_ruaC7nUR9FMpnesZg=mo,"aplikasi nge login sendri jika foto loading bug nya terlalu banyak ,",2,2,7.40.1,04/17/2025 6:07,"Hai kak Ahmadi Subroto. Maaf terkait kendala pada aplikasi ShopeeFood kamu. Aku infoin pastikan jaringan internet stabil, clear cache pada aplikasi ShopeeFood, coba berkala 1x24 jam. Agar bisa aku bantu cek, mohon infoin screenshot kendala berserta screenshot review ini ke DM IG @Shopeefood_id. Terima kasih ^NW",04/17/2025 8:09,7.40.1
91a85f28-3327-403e-a860-d53d855aa816,Twilight Angel,https://play-lh.googleusercontent.com/a-/ALV-UjXijC1FypBYgfBxieVk9dRjc671J1B9KVGIJsuG-ntsoJzdEAIR,"untuk double atau triple orderan, ongkir di sunat dan point pun d kikis pula' hehehe.",2,1,7.40.1,04/17/2025 6:05,,,7.40.1
61013890-99d3-4ca0-9a11-2fb3ec8d5b80,Falisha Rosdiana,https://play-lh.googleusercontent.com/a-/ALV-UjW_qsdWKohLQHUHh7N88PR-eTNpdjGeKUyb0AT6vsm3GHlKBmyo,server bego point pinalty bertambah pada tgl 20 Maret karna mercant TDK dpt di hubungi sedangkan di check riwayat 20 Maret TDK narik TDK ada jadwal MEMBAGONGKAN!!!!,1,1,7.40.1,04/17/2025 6:01,"Hai kak Falisha Rosdiana. Mohon maaf atas ketidaknyamanannya terkait kendala poin penalty. Agar aku bantu lebih lanjut, mohon infoin Driver ID ke DM IG @Shopeefood_id. Terima kasih ^NW",04/17/2025 8:04,7.40.1
75696273-45fb-49d7-9af6-10f7749c0853,Kustiyanto Kustiyanto,https://play-lh.googleusercontent.com/a/ACg8ocIZzsoS-YVZ6xbIdjYQo5v7MVGpxbbeNQ5vyHujtS1Fme72UQ=mo,"sistem payah,lemot, dikit2 notif,poin,Suspen, orderan dikasih makan ke hub terus,hiujan2 mending off,enak bobok dirumah, payahhhhh",1,29,7.40.1,04/17/2025 5:40,"hi kak Kustiyanto Kustiyanto, maaf ya udah buat kaka engga nyaman terkait sepi orderan, aku infoin pembagian order melalui sistem ya kak, selain itu performa dan rating juga mempengaruhi pesanan yang masuk. namun agar aku bisa bantu lebih lanjut boleh infoin id driver dan detail kendala ke DM IG di @Shopee_id / @Shopeecare ya, aku tunggu  🙏^RI",10/23/2024 3:12,7.40.1
d83ad9cb-2b89-4ff5-b1c2-88173983fd42,Sri Nur rahayu,https://play-lh.googleusercontent.com/a/ACg8ocJNBLnhEaQH-iPadn_q_6LyHLz4FZ2M7o-qBLKwHh4FAAvqgQ=mo,orderan adil kan trus ongkos lonjakan minimal dri jam 16 smpe jm 06 00 biar pun cmn 800 atau 1600 juga,1,0,7.39.0,04/17/2025 5:28,,,7.39.0
f0eba95b-5ca5-47f4-8129-aca0e6d940c3,Raden Panca,https://play-lh.googleusercontent.com/a-/ALV-UjUx_Tu1Nfo7wIDXgmK6RaB0mAT2jKwdkq3gNWbKLbzYquLyprc,"Maaf sementara saya kurangi bintang nya dari bintang 5 karena sistem pembagian order tidak adil menurut saya, ada sebagian yng tiap hari bisa tutup poin 12 bahkan sampai 17 (malang) tapi saya sehari hanya dapat 1 sampai 3 order tidak bisa tutup poin, dalam titik yang sama, sudah kirim form sepi order tapi tidak ada kelanjutan dan perubahan pada perolehan order, syarat sudah terpenuhi, tidak tahu mau mengadu kemana mungkin ada error pada aplikasi atau apa,",3,19,7.40.1,04/17/2025 5:20,,,7.40.1
bdb6750a-9690-4670-9c7a-c722915ebf1b,Eka Nursega,https://play-lh.googleusercontent.com/a-/ALV-UjVwsnA78yIc8SbbMD9YhIZcXJwxcZxSKXcGYxSUChLHmmgq7h0,aplikasi lucu,1,0,,04/17/2025 4:45,,,
a7d39567-b2ce-4798-8b32-f1f23fb61ddd,Tiriyo Optimus,https://play-lh.googleusercontent.com/a-/ALV-UjU6dTLE4_v_pXt-jczGNIsdrZ1wA8hIx1y8V6p3K_b6U9hHswPk,sakit,1,1,7.40.1,04/17/2025 4:41,,,7.40.1
d9562065-07cc-4fc7-9634-399b7e9146e2,Maryani Yani,https://play-lh.googleusercontent.com/a/ACg8ocJzEffucXhy1IFEiqH2bsLMwsirPcK_0ngnaFzFniaZOKsDSg=mo,makin kaga jelas.. Samday y murah.. kerja rodi.. yuu smua driver Jabodetabek.Jgn pda mau ambil order y,1,0,,04/17/2025 4:33,,,
bdac794f-d06f-4caa-9757-e1faa3668248,Aldi Nugraha,https://play-lh.googleusercontent.com/a-/ALV-UjWFyQZwUzSXmQnPtCyvI7saNtyTcMqYDJbrB4DlLUsWv-TBapPX,TOLONG JANGAN TERLALU MEMAKSA DRIVER UNTUK BEKERJA ..JANGAN TERLALU SENSITIVE KE DRIVER ..JIKA DRIVER CANCEL ORDERAN KARNA TUJUAN PERKAMPUNGAN DAN JARAK NYA JAUH JANGAN DI TAHAN AKUN NYA DAN KENA POINT PENALTY...DRIVER JUGA MANUSIA PERLU DI PAHAMI DAN DIMENGERTI.. JANGAN SEENAKNYA KE DRIVER. TARIF SESUAIKAN DG JARAK ..JANGAN TARIF MURAH JARAK GA KIRA² JAUH. . TOLONG LAH JANGAN ADA SPX DIMALAM HARI TOKO PADA TUTUP UDAH CANCEL SAMA DRIVER JADI KENA IMBASNYA DAN AKUN NYA DITAHAN.,1,1,7.40.1,04/17/2025 4:25,"Hi Kak Aldi Nugraha, maaf ya udah buat kakak ga nyaman terkait kendala akun yang ditahan. Supaya aku bisa bantu pengecekan lebih lanjut, kakak bisa kirimin aku Driver ID dan detail kendala melalui DM ke IG aku ya, di @Shopee_id / @Shopeecare_id ya, sehat selalu ^BQ",04/17/2025 5:20,7.40.1
1c72cabf-001b-4784-a92c-778c8ad4339f,Nana nanaee,https://play-lh.googleusercontent.com/a-/ALV-UjXbYcExuxb8o5SwA8ge65GJXpwApvbvC_CSWs_TnR32kiDsJOA,ongkir makin - k sini makin parah banget samday 10 titik dri jam 1 sore beres sampe jam 7 malam ongkir cuma 95 Rb server itu ga punya otak,1,1,7.40.1,04/17/2025 4:07,"Hi Kak Nana nanaee, maaf ya udah buat kakak ga nyaman terkait kendala ongkir. Supaya aku bisa bantu pengecekan lebih lanjut, kakak bisa kirimin aku username dan no pesanan yg berkendala melalui DM ke IG aku ya, di @Shopee_id / @Shopeecare_id ya, sehat selalu ^BQ",04/17/2025 5:16,7.40.1
7965fb36-6107-45ab-8767-82edf8e10f55,Iam Maulana,https://play-lh.googleusercontent.com/a/ACg8ocIifturOajEiy1aLFjSU0In6RqTHRW_6WQkAYsIZCm9_JlsbA=mo,aplikasi kocakk,1,1,7.40.1,04/17/2025 3:50,"Hai kak Iam Maulana  , mohon maaf atas ketidaknyamanannya . Biar bisa aku bantu pengecekan, Boleh infoin Detail kendala kakak  ke DM Social Media kita @Shopee_id/@ shopeecare_id/shopeepay_id ya. Terima kasih telah menghubungi shopee ^XR",04/17/2025 4:20,7.40.1
86fd5dfe-94fa-45ab-841e-f9bb303569c5,Lucky Bangsawan,https://play-lh.googleusercontent.com/a/ACg8ocKsia5_knkIzJeL1Cj7eV5nfIUVpzPsIQLPK2UzLgwoEEyVsw=mo,cuma 1 orderan setiap hari murah jhe harga bensin kh?bagaimana cara pembagian sistem mhu itu,1,1,7.40.1,04/17/2025 3:43,"Hi kak, maaf buat ga nyaman terkait orderan sepi. Aku infoin hal ini dikarenakan pesanan yg masuk diatur oleh sistem scr otomatis dan bergantung dari jumlah permintaan pembeli ya. Apabila ada pertanyaan/kendala terkait Shopee boleh infoin aku via DM ke sosmed @Shopee_id/@Shopeecare ya. Stay healthy ^SU",02/19/2025 15:07,7.40.1
539fb54f-c0f3-4258-a2d3-42a51b6963bc,Jamil Bakti permana,https://play-lh.googleusercontent.com/a-/ALV-UjVlL1EK9P_VEQHe5ixl4z23qBr6n3WvU8n5osYMGeBW-73fqNg,apa apa main poin. coba turun ke lapangan gimana kondisi di lapangan.,1,1,7.40.1,04/17/2025 3:16,"Hai kak Jamil Bakti permana  , mohon maaf atas ketidaknyamanannya . Biar bisa aku bantu pengecekan, Boleh infoin detail kendala dan ID driver  ke DM Social Media kita @Shopee_id/@ shopeecare_id/shopeepay_id ya. Terima kasih telah menghubungi shopee ^XR",04/17/2025 4:16,7.40.1
41ca72c2-93ef-4ce1-82de-23b30a320858,Sadilah Nirwana,https://play-lh.googleusercontent.com/a/ACg8ocIioR-CEDqD--6ZNOnBIDLONDOHAtPOQPUqg7Xr3VkXTT7A6Q=mo,update orderan shoppe food kemalaysia .,5,0,7.40.1,04/17/2025 3:04,"Hi kak Sadilah Nirwana  , makasih banyak ya untuk bintangnya.  Jika kakak ada kendala atau pertanyaan terkait shopee kakak bisa hubungi aku di DM ke Social Media kita @Shopee_id/@ shopeecare_id/shopeepay_id ya. Terima kasih telah menghubungi shopee ^XR",04/17/2025 4:15,7.40.1
570843d7-e42a-4af1-bdb2-958284f75856,Agus Sanjaya,https://play-lh.googleusercontent.com/a/ACg8ocLO93yjKy9k9NYzdTrR7nr6UkwRw2wubgVnrCO8quFx__UH2w=mo,"Titik sering ga akurat,,, mesin EDCnya lemot.. Orderan di driver udh masuk tp di resto sampe 30mnit blm masuk di mesin EDCnya.. argo udh ga ngotak murah banget,samdey nya ga kira2 jarak ambil nya ,barang nya jg gede2 ,argo murah gila..Parah bangett ini aplikasi ...",1,0,6.96.1,04/17/2025 3:04,"Hi kak, maaf ya udh bikin km bingung. Terkait kendala kmu, supaya bsa mimin bantu cek bsa infoin SS kendala dan username kmu melalui Live Chat atau DM ke Social Media kita @Shopee_id/@Shopeecare.Sehat Selalu 🙏^RN",05/04/2024 14:02,6.96.1
7820c8b9-e929-48dc-bbcc-e177d523d057,Suwantono Eleks,https://play-lh.googleusercontent.com/a-/ALV-UjVfUM_PJeY7BGxqgKx1zk7yqGM0REnhz_J8XaMJgT-CXPlNVLfo,kenapa shope tidak berani update app seperti grab atau gojak yang berikan driver bisa pilih layanan yang mau di kerjalan ? pasti takut sameday tidak ada yang driver mau ? makanya argo ngotak dikit dan lihat situasi jam . jangan jam 5 sore keatas masih ada sameday sameday . kantor shopee saja buka hanya sampai jam 5sore . uang banyak boleh tapi otak jangan dikit seperti otak udang,1,2,7.40.1,04/17/2025 2:57,,,7.40.1
a2267e5e-990a-4c7d-a1dd-86e1c5a853a1,Denn Pratama,https://play-lh.googleusercontent.com/a-/ALV-UjX_Bj-6rQIs49eOB0smmJ07o_3RSDgsCKXBW1on0aXstlBYnMw,mantap cukup membantu,5,0,1.42.1,04/17/2025 2:06,"Hi kak Denn Pratama  , makasih banyak ya untuk review dan bintangnya. aku ikut seneng deh kalo kakak suka dengan fitur dan pelayanannya. Jika kakak ada kendala atau pertanyaan terkait shopee kakak bisa hubungi aku di DM ke Social Media kita @Shopee_id/@ shopeecare_id/shopeepay_id ya. Terima kasih telah menghubungi shopee ^XR",04/17/2025 3:08,1.42.1
2c1fcca2-2c56-45fc-93ac-b043fc6f2136,Iman Rohmansyah,https://play-lh.googleusercontent.com/a-/ALV-UjUq3qSeC8vzTVpmWlQwLq0tKK3XghKOt_sTmXVdAqiUZecwabA,sangat bagus,5,0,7.40.1,04/17/2025 1:53,"Hi Kak Iman Rohmansyah, makasih bgt ya review dan bintang 5 nya. Aku suka bgt klo Kakak senang belanja di Shopeefood dan jadi semangat aku buat kasih pelayanan yg terbaik. Klo ada pertanyaan terkait Shopee jangan sungkan DM IG di @Shopee_id / @Shopeecare_id ya, sehat selalu^CN",04/17/2025 2:10,7.40.1
5eb7124b-6029-4d46-9337-6f66eb844db4,Ardi yanto Ardi,https://play-lh.googleusercontent.com/a-/ALV-UjUAwSjAp9dC0dL60WI_sBMDvXwtXgFEHYRoy3QXwZFrsrXwTA9a,"saran aku ni min,kasi lah parkir dimana yg ada parkir nya,kadang kesal juga masa resto yg udh tutup masuk juga udah jauh jauh, jemput kan kecewa kita.",3,0,7.40.1,04/17/2025 1:48,"Hai kak Ardi yanto Ardi, maaf ya udah buat kamu ngga nyaman karena kendala yg kamu alami. Biar bisa aku bantu pengecekan, kamu bisa infoin detail kendala kamu ke DM Social Media kita @Shopee_id / @Shopeecare_id ya Kak. Semoga kendala km dapat segera terselesaikan yaa kak. Sehat selalu^CN",04/17/2025 2:30,7.40.1
37dad136-3cd4-43ef-8402-5b956d027b74,Fridolin Satya,https://play-lh.googleusercontent.com/a/ACg8ocKvqqcnynkZBe12sNxMMHeuhfqVZLVN8CtADD_BoJmAGAImxA=mo,"semua driver sudah berkeluh kesah harusnya di dengar dan buat evaluasi karna sistem kalian emang benar benar buruk, kami yang katanya mitra tetapi serasa budak pekerja. sudah di akui sama driver sebelah kalo sistem mitra shopefood ini yang paling gokil alias ga jelas",1,4,7.38.0,04/17/2025 1:23,"Hai kak Fridolin Satya, terima kasih ya untuk feedbacknya. Kedepan shopee akan terus berusaha lebih baik lagi agar para pengguna lebih nyaman dalam menggunakan shopee. Klo ada pertanyaan/kendala, kaka bisa hubungi DM Social Media @Shopee_id . Sehat selalu ^FH",01/06/2025 3:28,7.38.0
d8f5ee97-54e2-4b79-9ff6-68378ed332c9,Tukang Ngupi,https://play-lh.googleusercontent.com/a-/ALV-UjVPbjIdCZkuskkVzneCpnpwPKAXjLQ0Rj848RykG7I-mSgYiwqjoQ,terimakasih 😊,5,0,7.40.1,04/17/2025 1:03,"Hi Kak Tukang Ngupi, makasih bgt ya review dan bintang 5 nya. Aku suka bgt klo Kakak senang belanja di Shopeefood dan jadi semangat aku buat kasih pelayanan yg terbaik. Klo ada pertanyaan terkait Shopee jangan sungkan DM IG di @Shopee_id / @Shopeecare_id ya, sehat selalu^CN",04/17/2025 2:09,7.40.1
9d43349c-ac84-449e-9e4e-af70225ed3d2,Hendra Si hadehate,https://play-lh.googleusercontent.com/a-/ALV-UjU1qEyd04cpzp8wtLd-a4HgtoAU5VCA_Aqd8ur-25cHCWbbTJSY,lebih bijak lagi dan hargai driver Jagan apa apa poin . lebih bijak lagi,1,0,7.38.0,04/16/2025 23:33,"Hai kakak Hendra Si hadehate, maaf ya terkait dengan kendala yang Kakak alami, kami akan jadikan sbg masukan utk mnjadikan Shopee lebih baik lagi. Kami selalu mencoba memberikan yang terbaik untuk para pengguna Shopee, jika km ada kndala/prtanyaan trkait shopee bisa hubungi aku melalui DM ke Social Media kami @shopee_id dan @shopeecare_id ya ^KH",04/17/2025 0:50,7.38.0
5bb78ac1-2f15-49d8-bec9-539f0dc6026f,Limp Fadli,https://play-lh.googleusercontent.com/a/ACg8ocK684Usi7-1XW0Tgp9aWqJ4POTwpqFOj5CqxplWhMJsMrYNh6s=mo,aplikasi ini mengekploitasi tenaga kerja indonesia dengan membayar argo driver yang sangat murah,1,7,7.40.1,04/16/2025 23:17,,,7.40.1
04cf902e-6804-4289-abf0-6fb7e83f8d8a,ahmad ikhlas,https://play-lh.googleusercontent.com/a/ACg8ocKlkqQTBxbm3pUYpfJYfoeu_eXw06iBCDhdildxR7s1MyzJZA=mo,"tolonglah shopee, saya sudah melakukan pengaduan orderan fiktif, dan sudah 4 hari pengajuan pengembalian dana belum diberikan saya sudah melakukan nya sesuai intruksi dari Shopee loh tolong lah jangan kecewakan saya",1,0,,04/16/2025 23:07,"Hai kak ahmad ikhlas , maaf ya uda buat ga nyaman trkait kendala pesanan yg kamu alami, terkait hal tersebut, agar bisa aku bantu pengecekan lebih lanjut. Mohon hubungi kami dengan memberikan username Shopee dan nomor pesanan berkendala melalui DM ke Social Media @shopee_id dan @shopeecare_id ya, aku tunggu, terima kasih ^KH",04/17/2025 0:35,
