reviewId,userName,userImage,content,score,thumbsUpCount,reviewCreatedVersion,at,replyContent,repliedAt,appVersion
83c706a7-21d7-40d9-827e-76b9b0db3c97,Cs stiker official,https://play-lh.googleusercontent.com/a-/ALV-UjV4fih_9LWEQ78bEUSDLXlgEyHd5R468rndh3F-BzqBt7iltSs8,"gak pernah cancel orderan, bukannya makin untung karena gacor tapi malahan makin gada duitnya abis cuma buat bensin. terpaksa saya cancel kalo jarak penjemputan di atas 2.5km .. kalian coba itung penjemputan 4km. antar 4km =8 km dan terus terusan begitu . ongkosnya 8k. setelah seharian di hitung full pendapatan 145k . bensin 50k. dapet 90k makan 2k 30k . sisa 60k roko dll . kebawa pulang 25k . kerja seharian . yang mau saya kasih tau buat developer coba batasi untuk max penjemputan",2,2,7.39.0,04/10/2025 15:58,"Hai kak Cs stiker official, mohon maaf atas ketidaknyamanan nya. terkait feedback dri kakak akan dijadikan evaluasi agar pelayanan dan juga performa aplikasi Shopee semakin lebih baik lagi ke depan nya. Kalau ada kendala terkait Shopee kakak bisa DM IG di @Shopee_id ya kak . Sehat selalu ^NE",04/10/2025 16:31,7.39.0
0038f8da-3c52-49e8-a920-d1368e668ebb,miftakhul huda,https://play-lh.googleusercontent.com/a-/ALV-UjUjJRoJeSSy5RT_eAWAb3Od59_1fSH7oPj5neqtayOkLG0ej7aGRA,sangat mudah digunakan,5,0,7.39.0,04/10/2025 15:37,"Hai kak miftakhul huda, makasih ya bintang dan reviewnya. Moga Shopee bisa terus kasih yang terbaik buat penggunanya biar kakak selalu nyaman dan aman pakai Shopee. Klo ada pertanyaan terkait Shopee jangan sungkan DM di @Shopee_id / @Shopeecare ya, sehat selalu ^NE",04/10/2025 16:24,7.39.0
f2b27eff-25b8-45af-bc9f-abc396dab84e,Andree Morronz (Andree),https://play-lh.googleusercontent.com/a-/ALV-UjUy56gYlgSQYV8odNK6XO_2UoBQCQt7jOFzizRuLCZ-oGLGKO2c,"⭐1 aja., ini juga udah bagus banget, nanti kalau sudah ada fitur pilih layanan dan fitur arah tujuan baru dah di tambah ⭐⭐⭐⭐ lg.",1,2,7.39.0,04/10/2025 15:19,"Hai kak Andree , maaf ya sudah bkin kmu gak nyaman. Terkait masukan dari kamu, akan dijadikan acuan untuk menjadikan Shopee lebih baik lagi. Shopee selalu mencoba memberikan yang terbaik untuk para pengguna Shopee. Jika kamu ada pertnyaan/kendala terkait shopee bisa infoin detailnya ke DM Sosmed ya kak. Sehat selalu  ^ GE",04/10/2025 16:19,7.39.0
563793b6-7e82-4220-b56a-cbbc7f52b6fe,asep sopian,https://play-lh.googleusercontent.com/a-/ALV-UjWtcO3DFicTfurpyNz5T6sQoj1ty5w4fcIm6Kp7Qrw51dEqmA,jalan pul ngga d kasih orderan,1,0,,04/10/2025 14:41,"Hai kaka asep sopian , maaf ya uda buat ga nyaman terkait kendala sepi order yg km alami, aku infoin terkait hal trsebut bahwa pembagian order melalui sistem ya kak, selain itu performa dan rating juga mempengaruhi pesanan yang masuk. pastikan kakak selalu melakukan konfirmasi progres pesanan dan membalas chat pembeli, stay care ^GE",04/10/2025 15:12,
c7bc2357-b0c6-45c2-b667-52cd8317a8dc,MOHAMMAD YUNUS,https://play-lh.googleusercontent.com/a-/ALV-UjXC491x4eWLzpPMyu9c3ob9QakiDYtnKbCFRT6RSAWlCm8ijrQf,"tolong adain fitur rating dan ulasan ke customer, dan kita bisa liat rating dan ulasan juga dari customer. itu jadi salah satu cara liat orderan fiktif atau gk lewat rating customer",4,1,7.39.0,04/10/2025 14:39,"Hai kak MOHAMMAD YUNUS , maaf ya sudah bkin kmu gak nyaman. Terkait masukan dari kamu, akan dijadikan acuan untuk menjadikan Shopee lebih baik lagi. Shopee selalu mencoba memberikan yang terbaik untuk para pengguna Shopee. Jika kamu ada pertnyaan/kendala terkait shopee bisa infoin detailnya ke DM Sosmed ya kak. Sehat selalu  ^ GE",04/10/2025 15:11,7.39.0
c6f7bacc-68b4-41c0-a492-b83c2eff14bb,Reza Januar,https://play-lh.googleusercontent.com/a/ACg8ocKjVQ-dTGfAKDOGS1jO-aHfdgBf4jc29u80HqoaoEggF5e64g=mo,untuk sekarang bintang 3 dulu karena aplikasi sering ngeblast jauh itu sistem harus di benerin,3,1,7.39.0,04/10/2025 14:09,"Hai kak Reza Januar  , maaf ya sudah bkin kmu gak nyaman. Terkait masukan dari kamu, akan dijadikan acuan untuk menjadikan Shopee lebih baik lagi. Shopee selalu mencoba memberikan yang terbaik untuk para pengguna Shopee. Jika kamu ada pertnyaan/kendala terkait shopee bisa infoin detailnya ke DM Sosmed ya kak. Sehat selalu  ^ GE",04/10/2025 15:09,7.39.0
daa51745-07a4-450b-9972-1b1cb9605bd2,FIP_ Agus Prasetyo,https://play-lh.googleusercontent.com/a-/ALV-UjUOdNQjqvzzn13DLcwBaiUjCH-QYZYSHrk3RJTMbMLYhCQjOiaO,ok,5,0,7.39.0,04/10/2025 14:02,"Hai kak, Makasih banyak ya untuk review dan bintangnya. Aku ikut seneng deh kalo kakak suka dengan fitur dan pelayanan yang ada di Shopee. Jika kakak ada kendala atau pertanyaan terkait shopee kakak bisa hubungi kembali di DM ke social media kita ya Kak. Have a nice day  ^GE",04/10/2025 15:09,7.39.0
f401b072-579f-4bcf-bc77-5736dea827a7,Sinta Arumi,https://play-lh.googleusercontent.com/a-/ALV-UjUZi_c8PXR2k-F2-DZuHqymFG2B_JKTLZHMqhmDrw5DErYl4F80,baik.,5,0,,04/10/2025 13:46,"Hi kak Sinta Arumi , makasih yaa untuk rating yang diberikan. Semoga kamu selalu senang berbelanja di Shopee ya kak. Yukk ceki-ceki selalu promo-promo yang berjalan di aplikasi Shopee biar kamu ga ketinggalan update promo seru. Have a nice day ^GU",04/10/2025 15:48,
c57302fb-4b6b-4ac0-8732-485eeb16b05d,Melky Dovisa,https://play-lh.googleusercontent.com/a-/ALV-UjW3QuGQp70EdxhgXT2HCFrxU8Ec1Te4uj13tmN8GI6frExJDzM,akun driver shopee food saya dari 2022 ga gacor2 makin bapuk aja perasaan udah gitu argonya makin lama makin ga jelas aja aneh ini sistem nya,1,0,6.83.0,04/10/2025 13:33,,,6.83.0
8e71ca1f-1d92-4b35-867e-612c2fdcefd2,Edhy Pratama,https://play-lh.googleusercontent.com/a-/ALV-UjUXQSvaU5n4I-hDysVf1tZ48wG-EN1dn4WfL3o0fpR4HvNWPPHb,telalu sensitit buat driver,1,1,7.39.0,04/10/2025 13:19,"Hi kak Edhy Pratama , maaf ya atas ketidaknyamanannya. Hal ini akan dijadikan masukan utk Shopee agar bisa lebih baik lagi buat kedepannya. Agar bisa aku bantu untuk cek, bisa infoin ke aku detail kendala km melalui DM Social Media ya kak @shopee_id / @shopeecare_id. Sehat selalu dan Terimakasih sudah menghubungi Shopee^GU",04/10/2025 15:59,7.39.0
9b923ca4-7247-48bd-9070-5a0faacbee68,Mochamad Ahya,https://play-lh.googleusercontent.com/a-/ALV-UjUKivKg_WvevQ9HbW_Y38uTcSANC0t4gr4R_Q3kx6mnuT_0hfqc,"kenapa ongkir yg muncul pertama kali dan saat penyelesain order selalu beda,terutama orderan longtrip atau doble order, dan ekspres misal tertera saat order bunyi muncul harga 10 rb,saat selesai order bisa jadi 8 rb atau 9 rb,bahkan itu berulang kali terjadi dan driver tiba tiba ada pemotongan dana driver dari spx instan dengan cuma alasan customer tidak menerima barang,padahal barang sudah terkirim,dan shopee tidak bisa menunjukkan alasan dan bukti ke driver,dan terkesan lepas tangan",1,111,7.39.0,04/10/2025 13:07,,,7.39.0
bd8ac047-41e3-4a4f-819b-925f2aa89d1b,Firman Triadi,https://play-lh.googleusercontent.com/a-/ALV-UjUMA3szt3AtWcxrsvq_1aP2Xz4ZXtm3MHyZqZrDup6EwS5I3Xw2,update terus tapi makin ga jelas 😠😡😤🤬,1,1,7.39.0,04/10/2025 13:02,,,7.39.0
217595e5-5691-437e-a85e-77b5dbee1922,Tsauban Vagas,https://play-lh.googleusercontent.com/a-/ALV-UjU9QTEA2Rn_YPZgx79QQzZ_8JoesUGNuWB7Z-qrOK-G1XfzPQ-d,JARAK 5KILO LEBIH PULANG PERGI HAMPIR 12 kilo ARGO GA NGOTAK CUMA 9600 DAPET PAKET BERAT 2KG,1,0,7.38.0,04/10/2025 13:00,"Hai kak Tsauban Vagas , maaf ya sudah bkin kmu gak nyaman. Untuk Argo ShopeeFood sudah diatur oleh sistem ya Kak. Kami selalu berusaha untuk memberikan tarif ongkos kirim yang sesuai untuk Mitra Pengemudi kami. Jika kamu ada pertnyaan/kendala terkait shopee bisa infoin detailnya ke DM Sosmed ya kak. Sehat selalu ^GU",04/10/2025 15:56,7.38.0
af43c90b-3903-4ba6-a7f3-7596912f99be,Jensen Jen,https://play-lh.googleusercontent.com/a/ACg8ocJfEKlvzRdNi0A1st2NT2BQqxfn36_P3iEgSpIsCWqs61JqeA=mo,saya berharap ada juga shopeebike,5,1,7.39.0,04/10/2025 12:59,"Haii kak Jensen Jen, makasih yaa buat review bintang 5 nya, yuk pantengin terus updatean dari sosmed resminya shopee dan aplikasi shopee yaa. Kalo ada kendala/pertanyaan lainnya bisa DM ke Social Media kita @ShopeeID/@Shopeecare. Sehat selalu ^ON",04/10/2025 14:07,7.39.0
3874ad13-e550-4fdf-a2b5-77e65643b7c8,Rusdimaulana Maulana,https://play-lh.googleusercontent.com/a-/ALV-UjVd8LyzP-rPzpF3emSjF9FMrOssKrZF9b89e-UiaEqE7eep3Q8c,aplikasi kurang menyenangkan dan kebanyakan penalti yg tidak diinginkan oleh driver dan suspent,4,1,7.39.0,04/10/2025 12:53,"Haii kak Rusdimaulana Maulana, maaf sudah bikin tidak nyaman terkait kendala yang kamu alami. Agar aku bisa bantu cek boleh infoin ID Driver kamu ke DM Social Media kita @ShopeeID/@Shopeecare. Sehat selalu ^ON",04/10/2025 14:48,7.39.0
f5c3cd5d-3e73-4551-99c0-cb4f6674d7ae,Indra Setiawan,https://play-lh.googleusercontent.com/a-/ALV-UjX2Zrourth0psEaXIwIY-T2S2EjDaQ1tMpM42GET2-KmZtHeC34,"Saya tahu masukan saya tidak akan berpengaruh penting pada aplikasi Shopeefood driver ini, tapi tolong tambahkan fitur layanan orderan agar driver bisa memilih layanan yang ingin digunakan, jadi hanya orderan dengan layanan tersebut yang masuk sehingga tidak ada pelanggaran dengan alasan tingkat penyelesaian rendah lagi. Saya mendaftar di aplikasi Shopeefood untuk mengantar orderan dalam bentuk makanan, bukan untuk mengarkan paket yang banyak dan bertumpuk seperti kurir.",5,0,7.11.0,04/10/2025 12:37,"hi kak, mohon maaf ya untuk kendala yang kamu alami. Shopee akan trs berusaha meningkatkan kualitasnya agar dpt memberikan kenyamanan kpda penggunanya. kalo ada yang mau ditanyain kamu bisa hubungi melalui Live Chat atau DM ke Media Sosial @Shopee_id / @Shopeecare ya. stay safe 🙏^JW",07/24/2024 11:45,7.11.0
797260b8-db3b-4b5d-a298-ec864681830a,Reka Agustian,https://play-lh.googleusercontent.com/a-/ALV-UjXJi6f4TWX_TaLzEoAw8aLiHqwD_HARK83FsZ1DnF5BOQsXl7tm,"Sangat tidak masuk akal nih Shopee food nyiksa driver, dengan argo hub jabodetabek 6.400 pick up 3km dan pengantaran 2km itu sangat menjengkelkan dan apa² kena poin mending pindah ke apk sebelah",1,1,7.39.0,04/10/2025 12:22,"Hai kak Reka Agustian , maaf ya sudah bkin kmu gak nyaman. Untuk Argo ShopeeFood sudah diatur oleh sistem ya Kak. Kami selalu berusaha untuk memberikan tarif ongkos kirim yang sesuai untuk Mitra Pengemudi kami. Jika kamu ada pertnyaan/kendala terkait shopee bisa infoin detailnya ke DM Sosmed ya kak. Sehat selalu ^ ON",04/10/2025 14:47,7.39.0
a2163ae2-0913-45d7-87c2-48ba6caa325f,Nurdin 1312,https://play-lh.googleusercontent.com/a/ACg8ocIX26IuKXeVOfzOgsPgO0x1TyQZpDGQ68hzUTaVc5JRCxHoQg=mo,semoga dibuat on off layanan sameday/instan/food dan fitur trip searah,4,1,7.39.0,04/10/2025 12:17,"Hi kak, maaf ya udah bkin kmu gak nyaman. Terkait masukan/saran dari kamu, akan aku jadikan acuan untuk Shopee lebih baik lagi. Aku slalu coba beri yg terbaik untuk pengguna Shopee. Jika ada pertnyaan/kendala trkait shopee bisa infoin detailnya ke DM IG @shopee_id/@Shopeecare_id ya ka. Sehat selalu 🙏 ^FT",10/30/2024 15:16,7.39.0
9eaa9359-4b3c-431b-b1e6-c8d23882d20c,Menot karu,https://play-lh.googleusercontent.com/a-/ALV-UjXPTfckW_1raVloE8lyXI6EbniVdAB_EaHHdcn9OHGpnVmiDVw,sistem ny ngerugiin driver,1,0,,04/10/2025 11:12,"Haii kak Menot karu, maaf sudah bikin tidak nyaman terkait kendala yang kamu alami. Agar aku bisa bantu cek boleh infoin detail kendala kamu ke DM Social Media kita @ShopeeID/@Shopeecare. Selamat beraktivitas kembali ^ON",04/10/2025 13:44,
63724c82-0470-4a05-9a7f-ce04432ab3a6,Maudi Fatur,https://play-lh.googleusercontent.com/a/ACg8ocL_JcSXoOUB4Fsxf2asAHy4Ud42z1N80DV4wVcVZSpbgs3TcQ=mo,"lama"" tidak jelas bntr"" poin padahal cuma ngelewatin satu orderan tiba Suspen 3 harii yg bener dong pihak it shope.",1,1,7.39.0,04/10/2025 11:04,"Haii kak Maudi Fatur, maaf sudah bikin tidak nyaman terkait kendala yang kamu alami. Agar aku bisa bantu cek boleh infoin ID Driver kamu ke DM Social Media kita @ShopeeID/@Shopeecare. Selamat beraktivitas kembali ^ON",04/10/2025 13:12,7.39.0
3b05f599-5a2a-422b-b8aa-49cc6d50f295,Ade Jamaludin,https://play-lh.googleusercontent.com/a-/ALV-UjX1WgTzbkw9LfFB0Hi5MNMiWF7x6IXcGGFoGjdWTb0_OvfCjdU,"tolong perbaiki sistemnya, driver mana yang mau penalti, maunya , perlu di ingat tolong sampaikan, driver itu budak ,dikit dikit penalti penalti, seharusnya hargai setinggi tingginya driver itu, perbaiki apk ya jangan rentan pelanggaran,",1,1,7.39.0,04/10/2025 11:03,"Hai kak Ade Jamaludin, maaf ya udah buat kamu ngga nyaman karena kendala yg kamu alami. Biar bisa aku bantu pengecekan, kamu bisa infoin username dan ss kendala kamu ke DM Social Media kita @Shopee_id/@Shopeecare_id ya Kak. Semoga kendala km dapat segera terselesaikan yaa kak. Sehat selalu^CN",04/09/2025 3:42,7.39.0
75acb2bf-9240-4edb-92fa-63ceaa37229e,sedih sepi,https://play-lh.googleusercontent.com/a/ACg8ocKUD4Gm8KW1DJEJCo5bqQYEuTRaKvCXOBvGWxEOi_lEIkq_uA=mo,kenapa bhr saya belum juga masuk...padahal menurut aplikasinsaya dapet 50 ... tapi sampai sekarang belum dicairkan juga tolong bantu kak,5,0,7.39.0,04/10/2025 10:37,"Hai kak, sedih sepi mohon maaf ya sudah buat kamu gak nyaman. Terkait kendala  kakak, agar bisa aku bantu cek, infoin ke aku detail kendalanya elalui DM IG @shopee_id/@shopeecare_id ya. Terima kasih telah menghubungi shopee sehat selalu ^WE",04/10/2025 11:51,7.39.0
39f81860-f0e7-4672-8a63-ad67d3f8948b,Husny Tamrin,https://play-lh.googleusercontent.com/a-/ALV-UjVl2zmKNCHXrNF0x4RhLAxXvs29CiVqu5DwAdGFlmfnDLz--Jb6,gak jelas shope baru ambil 1 orderan kena suspen ....gak pernah cancel orderan apa lagi milih 2 orderan dari kemarin .tadi siang habis beres anteri food mie gacoan,1,1,7.39.0,04/10/2025 10:23,"Hi kak Husny Tamrin, maaf buat ga nyaman terkait kendala yg kmu alami. Agar bisa aku bntu utk pengecekan, boleh infoin detail kendala km dgn memberikan screenshot review ini melalui DM ke Media Sosial @Shopee_id / @Shopeecare_id ya kak, Terimakasih dan sehat selalu kak^FO",04/10/2025 10:17,7.39.0
87525150-ece4-4511-928d-23fb113f7993,WinWin Solihin,https://play-lh.googleusercontent.com/a-/ALV-UjWpVsl5wh6Qtr_j-W6bvaYNb2b_E-qtHASYdYgeDERd_mC6Q4AQ,tiba tiba dapat poin pelanggaran padahal jarang ngancel,1,1,7.39.0,04/10/2025 9:43,"Hi kak WinWin Solihin, maaf buat ga nyaman terkait kendala yg kmu alami. Agar bisa aku bntu utk pengecekan, boleh infoin detail kendala km dgn memberikan screenshot review ini melalui DM ke Media Sosial @Shopee_id / @Shopeecare_id ya kak, Terimakasih dan sehat selalu kak^FO",04/10/2025 10:19,7.39.0
4cc420c6-f538-468b-b584-2e3e8b3816c0,Agus,https://play-lh.googleusercontent.com/a/ACg8ocIRUjjlU3gqJdb7sJTcXeb9o946GxhwR6Evf_76iBwlqvMeWQ=mo,"aplikasi tolol,tanpa driver aplikasi bisa apa?dikit dikit ngasih poin pelanggaran,argo semakin hancur,dobel order gak ngotak.",1,1,7.32.1,04/10/2025 9:29,,,7.32.1
72a670d0-ff1b-4f84-a197-71924636d58e,Subhan 01,https://play-lh.googleusercontent.com/a/ACg8ocIuLaSitXJnjaZk2Ve1h4vurW2gjJNHUGZWP63-qzrq60PACA=mo,"Aplikasi tolol,dikit2 ngasih point pelanggaran,tanpa driver aplikasi bisa apa?",1,7,7.39.0,04/10/2025 9:23,,,7.39.0
6a69e1ef-2541-4b09-95d1-3343dde4ac72,ferry setiawan,https://play-lh.googleusercontent.com/a-/ALV-UjWVz2O9uhb0ty1lD33AVT_VnKwiA-mYN2wQgTOUKR-SH9dor1U,sebagai mitra kita dipaksa buat ambil orderan...kaga di ambil suspend...harga tidak seberapa barang yg sering kita ambil besar dan berat...tidak sesuai di aplikasi nya....paling sering dapat double mau pun trypell..makin kesini seenak nya,1,1,7.35.0,04/10/2025 9:21,"Hi kak ferry setiawan, maaf buat ga nyaman terkait kendala yg kmu alami. Agar bisa aku bntu utk pengecekan, boleh infoin detail kendala km dgn memberikan screenshot review ini melalui DM ke Media Sosial @Shopee_id / @Shopeecare_id ya kak, Terimakasih dan sehat selalu kak^FO",04/10/2025 10:25,7.35.0
08dc15e6-7225-4378-bc2a-c8f396cb0dce,Bravo Brav,https://play-lh.googleusercontent.com/a/ACg8ocLpl8CvSO5ilcubfJlgI7NIviHLk79k80Nc7z4MND_5Fv0l8A=mo,"aplikasi pea,bknya tambah bner peraturan,Mlah tambah parah peraturan gk jls",1,0,7.38.0,04/10/2025 9:05,"Hi kak Bravo Brav, maaf udah bikin ga nyaman terkait Shopee. Terima kasih utk feedbacknya. Shopee selalu berupaya utk meningkatkan pelayanan kepada pengguna & berusaha memberikan yg terbaik. Terkait kendala kamu, Aku infoin kamu bisa chat ke aku melalui DM ke sosmed @Shopee_id/@Shopeecare dgn melampirkan detail kendala &  username. Sehat selalu ^RB",04/10/2025 10:29,7.38.0
2463ab94-3212-4ca4-ad84-323e565e3a6d,Ajiezahra Ajie,https://play-lh.googleusercontent.com/a-/ALV-UjWm7kqyVaCcAnf3fLlaewCqnuRL5gdcZEsRAKRvTqCXgWljKBUZqw,harus kaya gojek grab donk censel sama lewat ga di suspend dari pada di suspend mending ga di kasih oderan satu hari kalau shopi yg grab SMA gojek sya acungin jempol,1,1,7.39.0,04/10/2025 9:05,"Hi kak Ajiezahra Ajie , maaf banget ya udah buat kamu ga nyaman. terkait kendala kamu, Aku infoin kamu bisa chat ke aku melalui DM ke social media @Shopee_id/@Shopeecare dgn melampirkan ss kendala dan ID Driver. Sehat selalu ^RB",04/10/2025 10:24,7.39.0
490dc694-d269-42a5-a948-fd72ddf933e3,Sulthan Santana,https://play-lh.googleusercontent.com/a/ACg8ocJV1pDW59Ba4jgODHBR3WEx2jWfTYX6eDWsUCQw9EyVImie3g=mo,aplikasi ga jelas dapet point penalti terus padahal udah auto bid tapi tingkat penyelesaian rendah. mutusin rezeki orang nih aplikasi. baru juga 1 bulan lebih tapi point udah gede gara gara sistemnya aneh.,1,12,7.39.0,04/10/2025 8:57,"Hi kak Sulthan Santana , maaf ya atas ketidaknyamanannya. Hal ini akan dijadikan masukan utk Shopee agar bisa lebih baik lagi buat kedepannya. Agar bisa aku bantu untuk cek, bisa infoin ke aku detail kendala km melalui DM Social Media ya kak @ShopeeID / @Shopeecare. Sehat selalu dan Terimakasih sudah menghubungi Shopee^GU",04/10/2025 9:08,7.39.0
7c9cedbf-7fa6-4486-b533-c88cbb55975c,Initial A,https://play-lh.googleusercontent.com/a/ACg8ocIXBkGpXFnVt4ADT2MnCV5C6bgYOvyCeolSTvDIb4LHNCHQcA=mo,"aplikas kgk jelas, emg orang harus sllu ol truz, ada saat nya ada keperluan pribadi, ini di bkng melakukan pelanggaran, aplikasi pea",1,3,7.38.0,04/10/2025 8:55,,,7.38.0
97e80506-af3e-4fcd-890b-091c90bab37f,Rizky Barkah,https://play-lh.googleusercontent.com/a/ACg8ocIXvMUhRHhjHX7kQHQT0UNG5kbBAzTSVF-IvARGkNv_w2geVQ=mo,"aplikasi mitra driver yang paling jelek,,ongkir sedikit bngtt ga masuk akal apalagi ditambah orderan double,triple,sameday ga ngotak sekali jarak tempuh dengan ongkirnya,,,di tolak suspend dikit2 suspend,,aplikasi mitra driver yang paling tidak bisa membuat driver nya makmur,,bener aja shopee paling laku ternyata mitra dan karyawannya yang di pressure habis2 an,,aplikasi yang gabisa memanusiakan manusia,,lebih berfikir lagi dengan mitra kalian ini difikirkan kemakmuranya bukan cuma ambil untung",1,1,7.35.0,04/10/2025 8:53,"Hi kak Rizky Barkah , maaf ya atas ketidaknyamanannya. Hal ini akan dijadikan masukan utk Shopee agar bisa lebih baik lagi buat kedepannya. Agar bisa aku bantu untuk cek, bisa infoin ke aku detail kendala kamu melalui DM Social Media ya kak @ShopeeID / @Shopeecare. Sehat selalu dan Terimakasih sudah menghubungi Shopee^GU",04/10/2025 9:07,7.35.0
88b77c44-a6fd-404a-bd57-26c9243f6150,Desril Uyee,https://play-lh.googleusercontent.com/a-/ALV-UjX0FSnk4cvnCKswReKlYSN5aWxbWwsKOxYUJ0jq4WV8l97EcRI,biar akun saya gacor,4,0,7.39.0,04/10/2025 8:40,,,7.39.0
c3cd7b7f-8bf3-4b2d-963b-5699dc153645,Surya Ramadhan,https://play-lh.googleusercontent.com/a-/ALV-UjWaantJr-mElwIHKEvTZ1JtCUXZgDOTrM_YTakqxHpdDqXrbK9g,"parah akun saya tiba' jadi jelek banget padahal saya gaa melakukan pelanggaran apapun, tiba' jadi anyep kocak",1,0,7.39.0,04/10/2025 8:36,"Hi kak Surya Ramadhan , maaf ya atas ketidaknyamanannya. Hal ini akan dijadikan masukan utk Shopee agar bisa lebih baik lagi buat kedepannya. Agar bisa aku bantu untuk cek, bisa infoin ke aku ID Driver dan detail kendala km melalui DM Social Media ya kak @ShopeeID / @Shopeecare. Sehat selalu dan Terimakasih sudah menghubungi Shopee^GU",04/10/2025 9:18,7.39.0
3bdc69ac-31f6-4c7b-aa1a-16666497f884,Dikalz,https://play-lh.googleusercontent.com/a-/ALV-UjX-_Nbw_irUBcAcbnAMBPMo3sYrqplwTEl8uBRRXcE2PGqs7S4h,"aplikator makin tolol gajelas gangotak, yg tau dan merasakan aja",1,0,6.99.9,04/10/2025 8:34,"Hi kak Dikalz, maaf ya atas ketidaknyamanannya. Hal ini akan dijadikan masukan utk Shopee agar bisa lebih baik lagi buat kedepannya. Agar bisa aku bantu untuk cek, bisa infoin ke aku detail kendala km melalui DM Social Media ya kak @ShopeeID / @Shopeecare. Sehat selalu dan Terimakasih sudah menghubungi Shopee^GU",04/10/2025 9:17,6.99.9
8c4433db-c763-4a74-b344-c7bd36d3267c,Rudi Yanto,https://play-lh.googleusercontent.com/a-/ALV-UjWowK4P237tk5j2PUorHnjl8fOfrZRBndqlv9kScBFd0M3ibAE,aplikator yg meraup untung banyak ga berpihak ke driver,1,0,7.39.0,04/10/2025 8:01,,,7.39.0
f62de4c6-4a05-4258-a960-125e4f1b1a43,Adam Ahmad21,https://play-lh.googleusercontent.com/a-/ALV-UjUVTKz9d026lh8IiORCVQPMw1jFMaBosyaf7wW5PGtri50Ve9x8,Aplikasi tolol argo kecil bubarin aja apk dongo ini,1,1,7.38.0,04/10/2025 7:54,"Hi Kak, Maaf udah buat kamu tidak nyaman. Feedback dan masukkan dari kamu akan Shopee jadikan evaluasi lebih baik lagi kedepannya. Jika ada pertanyaan terkait Shopee jgn sungkan chat ke Live Chat / DM ke Social Media Shopee di @Shopee_id atau @Shopeecare ya. Sehat selalu 🙏 ^HQ",03/06/2024 5:20,7.38.0
65dd9501-496c-4d78-a6e3-278c18b18b98,Dadan Basari,https://play-lh.googleusercontent.com/a/ACg8ocIPsjBC2jODIKs9MFMl-gF03kr3_JK_pZdYTconYrCbfd3TRA=mo,"aplikasi penjajah. ga pernah mikirin driver, dikit2 suspend dikit2 suspend, mitra dipaksa untuk bawa semua orderan (kita ini mitra apa karyawan??). aplikasi paling merugikan driver. ga boleh salah sedikit, sistem paling tolol sedunia. Sameday sampe 12 barang, instant sampe 5 barang, toko tutup yang di suspend driver. tololnya kebangetan",1,3,7.39.0,04/10/2025 7:34,"Hi kak Dadan Basari, maaf ya atas ketidaknyamannya terkait kendala yang kakak alami, agar bisa aku bntu cek, boleh infoin detail kendala kakak melalui DM di Shopee Id, aku tunggu ya kak, Terimakasih telah menghubungi Shopee^NC",04/10/2025 8:10,7.39.0
1b6aa474-7e19-47aa-97fa-8b688af21424,Rigar Sonjaya,https://play-lh.googleusercontent.com/a-/ALV-UjV76wtXl5AcwlBmq5ss6WdOrKYAUi8roZIzmUUx2PvZNkSDyqJ4,MINIMAL BISA MEMANUSIAKAN MANUSIA,1,0,7.35.0,04/10/2025 7:25,"Hi kak Rigar Sonjaya , maaf ya atas ketidaknyamannya terkait kendala yang kakak alami, agar bisa aku bntu cek, boleh infoin detail kendala kakak melalui DM di Shopee Id, aku tunggu ya kak, Terimakasih telah menghubungi Shopee^NC",04/10/2025 8:25,7.35.0
f0734b6c-af74-4995-9802-71db17e9e0de,Ndoyy Lagi,https://play-lh.googleusercontent.com/a/ACg8ocLJ3Zvur1W3zn98AxzrHMIxo2ehrbOQfP8d3jIvfYkx7Ai75g=mo,gabisa cancel. meski alasan jelas tetap kena sanksi. point pentingnya (pokonya cuan buat orang kantor),1,3,,04/10/2025 7:23,"Hi kak Ndoyy Lagi , maaf ya atas ketidaknyamannya terkait kendala yang kakak alami, agar bisa aku bntu cek, boleh infoin detail kendala kakak melalui DM di Shopee Id, aku tunggu ya kak, Terimakasih telah menghubungi Shopee^NC",04/10/2025 8:23,
6981de15-24a1-4704-a74c-40493a6282ba,Boy Tan,https://play-lh.googleusercontent.com/a/ACg8ocISYuek20o1JtLQ6XDf0A7o0HMi0gf-db0cI7lGMRf_eWoQ3iA=mo,"Aplikasi jahat ongkir makin di turunkan terus dengan program double triple order, pakai logika dong kalau dikit dikit maen point' pinalti terus harus lihat di lapangan seperti apa kesulitan para driver nya...harus evaluasi itu sistem bobrok",1,10,7.38.0,04/10/2025 7:03,,,7.38.0
417ab1ed-1286-4a71-9f16-d4d9a845064b,Shatar 15,https://play-lh.googleusercontent.com/a/ACg8ocIwhgF2dRD0cmCOKffDhIWEKYxm4L0jfyUGzNln6fFrylH_Lg=mo,"lebih mementingkan untung dari pada kesejahteraan driver , ongkos kirim ga masuk akal untuk driver , mohon segera di perbaiki",1,0,7.38.0,04/10/2025 6:56,,,7.38.0
ff6119e2-dd8c-458f-9855-19e289b98f16,Riie Noviyandi,https://play-lh.googleusercontent.com/a-/ALV-UjWHeny-qZw3MWQPhkYDn61TSwUWfBvnXq-58iV1QHTUP2EUimE,tambahkan layangan nya seperti aplikator lain jangan setak di food dan paket aja,2,1,7.39.0,04/10/2025 6:19,"Hi kak Riie Noviyandi, maaf ya buat risau terkait layanan shopee, aku infoin ya shopee menyediakan banyak layananan ya, berikut layanannya ada ShopeePay, Shopee Mall, Shopee Live, Shopee Games, Shopee Food, shopee affiliate & masih bnyak lagi ya, km bisa cek langsung di aplikasi shopee yaa, makasi tlah hubungi shopee, sehat selalu^NC",04/10/2025 7:48,7.39.0
ce475742-14d4-49f2-9759-8699789c6b8e,Ega Gustana,https://play-lh.googleusercontent.com/a-/ALV-UjXpEgBpYBzzf0N2ieCVvPMvtLccH_zO0FBoXP2-43UxaqTCyiha,saya daftar shopee driver pas mau menghubungkan shoopepay malah eror gak ada solusi kecewa dah,1,0,,04/10/2025 6:11,"Hi kak Ega Gustana , maaf ya atas ketidaknyamannya terkait kendala menghubungkan shopeepay kakak, agar bisa aku bntu cek, boleh infoin detail kendala kakak melalui DM di Shopee Id, aku tunggu ya kak, Terimakasih telah menghubungi Shopee^NC",04/10/2025 7:22,
b4928ecf-db4c-4dc0-aa42-031d7e010669,jumpa la,https://play-lh.googleusercontent.com/a/ACg8ocIcNKX8jyVaTwXTrHTzLjlwLVRoJrIs4tZORmA4JEnbqSyJWg=mo,"kasih bintang ke costumer, biar tau driver riwayat costumer",1,0,,04/10/2025 6:00,"Hi kak jumpa la, maaf buat risau trkait kendala kakak, aku infoin Feedback dari kakak akan kami jadikan masukan agar kedepannya shopee bisa lebih baik lagi ya Kak, Kalo ada prtanyaan trkait Shopee jgn sungkan DM ak di @Shopee_id ya, makasi telah menghubungi shopee, sehat selalu^NC",04/10/2025 7:53,
58dd85e1-3e0b-4f0a-9c93-9abd6e0f1c27,Amri01 Ds,https://play-lh.googleusercontent.com/a-/ALV-UjUoOgQgQskArbeS7RwN-JjOe89IRP9mjHBn9KWRwLg7a63N9wQ,ok,5,0,7.39.0,04/10/2025 5:58,"Hallo kak Amri01 Ds, Makasih yaa buat review bintang 5 nya, yuk pantengin terus updatean dari sosmed resminya shopee dan aplikasi shopee yaa. Kalo ada kendala/pertanyaan lainnya bisa DM ke Social Media kita DM ke Social Media kita @shopee_id/@shopeecare_id. Sehat selalu^NB",04/10/2025 6:24,7.39.0
d2f25d25-46e1-477a-a8df-2a89f85a8ae7,Cak wani Sulis,https://play-lh.googleusercontent.com/a-/ALV-UjVQa1gPEINbS6D4Y7zKbxUuDdozs_LyIBXGzB5gusgbZgX094I,bener bener aplikasi udah kaya belanda kalian ini jajah rakyat. argo di turunin jarak makin jauh ampun dh ahc. pantas bintang satu untuk kalian.,1,0,,04/10/2025 5:52,,,
